id,category,subcategory,question,option_a,option_b,option_c,option_d,correct_answer,rationale,certification,difficulty
1,Medical,Diabetes,Type 1 diabetes results from:,Insulin resistance,Autoimmune destruction of insulin-producing cells,Obesity,Medication side effect,B,Type 1 is autoimmune destruction of pancreatic beta cells requiring insulin.,AEMT,medium
2,Medical,Diabetes,Type 2 diabetes results from:,Autoimmune destruction,Insulin resistance and relative insulin deficiency,Viral infection,Trauma,B,Type 2 involves insulin resistance; cells do not respond properly to insulin.,AEMT,medium
3,Medical,Diabetes,Insulin is produced by:,Liver,Pancreatic beta cells,Adrenal glands,Thyroid,B,Insulin produced by beta cells in islets of Langerhans in pancreas.,AEMT,medium
4,Medical,Diabetes,Glucagon is produced by:,Beta cells,Alpha cells of the pancreas,Liver,Adrenal glands,B,Glucagon produced by pancreatic alpha cells; raises blood glucose.,AEMT,medium
5,Medical,Diabetes,Normal fasting blood glucose is:,40-60 mg/dL,70-100 mg/dL,120-150 mg/dL,200-300 mg/dL,B,Normal fasting glucose 70-100 mg/dL.,AEMT,medium
6,Medical,Diabetes,Hypoglycemia signs and symptoms result from:,High blood sugar,Brain and body deprived of glucose and catecholamine release,Dehydration,Infection,B,Low glucose causes CNS dysfunction and sympathetic activation.,AEMT,medium
7,Medical,Diabetes,Early signs of hypoglycemia include:,Dry skin,Sweating anxiety tremor hunger,Fruity breath,Kussmaul respirations,B,Early hypoglycemia: diaphoresis anxiety tremor tachycardia hunger.,AEMT,medium
8,Medical,Diabetes,Severe hypoglycemia may cause:,Improved alertness,Seizures unconsciousness,Polyuria,Kussmaul breathing,B,Severe hypoglycemia can cause seizures unconsciousness brain damage death.,AEMT,medium
9,Medical,Diabetes,Blood glucose level for hypoglycemia treatment:,Less than 100 mg/dL,Less than 70 mg/dL with symptoms,Less than 200 mg/dL,Less than 300 mg/dL,B,Treat hypoglycemia when glucose less than 70 mg/dL with symptoms.,AEMT,medium
10,Medical,Diabetes,Oral glucose is contraindicated when:,Patient is alert,Patient cannot swallow or protect airway,Blood sugar is low,Patient is conscious,B,Do not give oral glucose if patient cannot swallow or protect airway.,AEMT,medium
11,Medical,Diabetes,After giving oral glucose reassess in:,30 minutes,10-15 minutes,1 hour,5 minutes,B,Reassess blood glucose 10-15 minutes after oral glucose administration.,AEMT,medium
12,Medical,Diabetes,Glucagon onset of action is:,Immediate,10-20 minutes,1 hour,30 seconds,B,Glucagon IM takes 10-20 minutes to raise blood glucose.,AEMT,medium
13,Medical,Diabetes,Glucagon may be ineffective in:,Type 1 diabetics,Patients with depleted glycogen stores alcoholics malnourished,Type 2 diabetics,Obese patients,B,Glucagon requires liver glycogen stores; ineffective if depleted.,AEMT,medium
14,Medical,Diabetes,IV dextrose onset of action is:,10-20 minutes,Almost immediate 1-2 minutes,30 minutes,1 hour,B,IV dextrose works almost immediately raising blood glucose.,AEMT,medium
15,Medical,Diabetes,D50 should be given through:,Any IV size,Patent IV to avoid tissue damage,IM injection,Subcutaneous,B,D50 is hyperosmolar; extravasation causes tissue necrosis; ensure patent IV.,AEMT,medium
16,Medical,Diabetes,D10 advantage over D50 is:,Higher concentration,Less risk of tissue damage if extravasation,Faster onset,Longer duration,B,D10 is less hyperosmolar; less tissue damage risk; easier to titrate.,AEMT,medium
17,Medical,Diabetes,Signs of hyperglycemia include:,Diaphoresis and tremor,Polyuria polydipsia polyphagia,Seizures,Cold clammy skin,B,Hyperglycemia: polyuria polydipsia polyphagia weight loss fatigue.,AEMT,medium
18,Medical,Diabetes,Diabetic ketoacidosis develops over:,Minutes,Hours to days,Weeks,Immediately,B,DKA typically develops over hours to days with illness or missed insulin.,AEMT,medium
19,Medical,Diabetes,DKA occurs most commonly in:,Type 2 diabetes,Type 1 diabetes,Pre-diabetes,Gestational diabetes,B,DKA more common in Type 1; can occur in Type 2 under severe stress.,AEMT,medium
20,Medical,Diabetes,Precipitating factors for DKA include:,Rest,Infection missed insulin illness stress,Exercise,Eating regularly,B,DKA triggers: infection illness missed insulin surgery trauma.,AEMT,medium
21,Medical,Neurological,Stroke is also called:,Heart attack,Cerebrovascular accident CVA,Seizure,Syncope,B,Stroke or CVA is disruption of blood supply to part of brain.,AEMT,medium
22,Medical,Neurological,Ischemic stroke is caused by:,Bleeding in brain,Blocked blood vessel in brain,Head trauma,Infection,B,Ischemic stroke from clot blocking cerebral artery; most common type.,AEMT,medium
23,Medical,Neurological,Hemorrhagic stroke is caused by:,Blood clot,Bleeding into brain tissue,Tumor,Infection,B,Hemorrhagic stroke from ruptured blood vessel bleeding into brain.,AEMT,medium
24,Medical,Neurological,TIA transient ischemic attack:,Causes permanent damage,Resolves within 24 hours without permanent damage,Is not serious,Requires no follow-up,B,TIA symptoms resolve within 24 hours; warning sign for future stroke.,AEMT,medium
25,Medical,Neurological,Sudden severe headache worst ever may indicate:,Tension headache,Hemorrhagic stroke or aneurysm,Migraine,Sinus headache,B,Thunderclap headache may indicate subarachnoid hemorrhage.,AEMT,medium
26,Medical,Neurological,Facial droop arm drift and speech abnormality are assessed by:,Glasgow Coma Scale,Cincinnati Stroke Scale,APGAR,Trauma score,B,Cincinnati Stroke Scale or FAST assesses for stroke.,AEMT,medium
27,Medical,Neurological,FAST stands for:,Face Arms Speech Time,First Aid Stroke Treatment,Fast Action Stroke Team,Face Arm Strength Test,A,FAST: Face drooping Arm weakness Speech difficulty Time to call 911.,AEMT,medium
28,Medical,Neurological,Treatment for stroke focuses on:,Lowering blood pressure rapidly,Maintaining oxygenation protecting airway rapid transport,Giving aspirin always,IV fluids,B,Stroke treatment: airway protection oxygenation rapid transport to stroke center.,AEMT,medium
29,Medical,Neurological,Blood glucose should be checked in stroke patients because:,All stroke patients are diabetic,Hypoglycemia can mimic stroke,It is required,Hyperglycemia worsens stroke,B,Check glucose; hypoglycemia can cause stroke-like symptoms and is treatable.,AEMT,medium
30,Medical,Neurological,Stroke patients should be transported to:,Closest hospital,Stroke center if available within appropriate time,Any hospital,Trauma center,B,Transport to stroke center for tPA evaluation and specialized care.,AEMT,medium
31,Medical,Seizures,A seizure results from:,Heart problems,Abnormal electrical discharge in brain,Respiratory failure,Drug overdose,B,Seizures are caused by abnormal excessive electrical activity in brain.,AEMT,medium
32,Medical,Seizures,Aura before seizure refers to:,Seizure activity,Warning sensation patient experiences,Post-seizure confusion,Absence seizure,B,Aura is sensory warning before seizure; patient may sense it coming.,AEMT,medium
33,Medical,Seizures,Tonic phase of seizure is:,Jerking movements,Muscle rigidity and stiffening,Relaxation,Postictal state,B,Tonic phase is sustained muscle contraction stiffening.,AEMT,medium
34,Medical,Seizures,Clonic phase of seizure is:,Sustained stiffness,Rhythmic jerking movements,Relaxation,Aura,B,Clonic phase is rhythmic jerking muscle contractions.,AEMT,medium
35,Medical,Seizures,Postictal state is:,Before seizure,Recovery period after seizure,During seizure,Normal state,B,Postictal is recovery period with confusion drowsiness headache.,AEMT,medium
36,Medical,Seizures,Absence seizures are characterized by:,Convulsions,Brief staring episodes,Postictal confusion,Falling,B,Absence seizures are brief staring spells without convulsions.,AEMT,medium
37,Medical,Seizures,Causes of seizures include:,Head injury only,Epilepsy head injury hypoglycemia fever drugs,Only epilepsy,Only fever,B,Many causes: epilepsy trauma hypoglycemia electrolytes drugs fever.,AEMT,medium
38,Medical,Seizures,During active seizure you should:,Restrain patient,Protect from injury time seizure do not restrain,Insert OPA,Give medications,B,Protect from injury move hazards time seizure do not restrain or insert objects.,AEMT,medium
39,Medical,Seizures,After seizure stops priority is:,Wake patient,Maintain airway and monitor breathing,Start IV immediately,Transport sitting up,B,Post-seizure: maintain airway provide O2 suction if needed monitor.,AEMT,medium
40,Medical,Seizures,Transport position for postictal patient:,Sitting upright,Recovery position if no spinal concerns,Supine,Trendelenburg,B,Recovery position allows drainage protects airway in postictal patient.,AEMT,medium
41,Medical,Allergic,Histamine release causes:,Vasoconstriction,Vasodilation increased permeability bronchospasm,Decreased heart rate,Decreased secretions,B,Histamine causes vasodilation capillary leak bronchospasm secretions.,AEMT,medium
42,Medical,Allergic,Mild allergic reaction signs include:,Hypotension,Hives itching localized swelling,Stridor,Shock,B,Mild reaction: urticaria pruritus localized angioedema.,AEMT,medium
43,Medical,Allergic,Severe allergic reaction signs include:,Hives only,Respiratory distress hypotension altered mental status,Localized itching,Minor swelling,B,Severe: airway compromise respiratory distress cardiovascular collapse.,AEMT,medium
44,Medical,Allergic,Anaphylaxis is:,Localized reaction,Severe systemic allergic reaction life-threatening,Mild allergy,Contact dermatitis,B,Anaphylaxis is severe rapidly progressing potentially fatal allergic reaction.,AEMT,medium
45,Medical,Allergic,Anaphylaxis can cause death by:,Hives,Airway obstruction and cardiovascular collapse,Itching,Rash,B,Death from airway edema bronchospasm or distributive shock.,AEMT,medium
46,Medical,Allergic,Biphasic anaphylaxis means:,Two allergens,Symptoms may return 1-72 hours later,Two treatments needed,Two patients affected,B,Biphasic: recurrence of symptoms hours after initial resolution.,AEMT,medium
47,Medical,Allergic,After epinephrine for anaphylaxis monitor for:,Complete resolution only,Symptom recurrence respiratory distress,Immediate improvement only,No monitoring needed,B,Monitor closely; symptoms may recur and patient may need repeat dose.,AEMT,medium
48,Medical,Allergic,Common allergens include:,Only peanuts,Foods medications insect stings latex,Only medications,Only bee stings,B,Common triggers: foods nuts shellfish drugs antibiotics stings latex.,AEMT,medium
49,Medical,Allergic,Angioedema is swelling of:,Surface skin only,Deeper tissues including face lips tongue airway,Joints only,Muscles only,B,Angioedema involves deeper dermal and subcutaneous tissues.,AEMT,medium
50,Medical,Allergic,Stridor in allergic reaction indicates:,Lower airway obstruction,Upper airway obstruction requiring immediate treatment,Normal finding,Minor reaction,B,Stridor indicates upper airway edema; emergency requiring epinephrine.,AEMT,medium
51,Medical,Toxicology,Toxicology is the study of:,Normal medications,Poisons and their effects,Allergies,Infections,B,Toxicology studies poisons overdoses and their effects on body.,AEMT,medium
52,Medical,Toxicology,Routes of poisoning include:,Ingestion only,Ingestion inhalation injection absorption,Only injection,Only inhalation,B,Poison routes: ingestion inhalation injection transdermal absorption.,AEMT,medium
53,Medical,Toxicology,When obtaining history of poisoning ask about:,Substance amount time and any treatment,Only the substance,Only the time,Nothing specific,A,WHAT WHEN HOW MUCH any treatments; bring containers to hospital.,AEMT,medium
54,Medical,Toxicology,Poison control center number is:,911,1-800-222-1222,1-800-911-9111,Local hospital,B,National Poison Control Center 1-800-222-1222.,AEMT,medium
55,Medical,Toxicology,Activated charcoal dose for adults is:,10 grams,25-50 grams,100 grams,5 grams,B,Adult activated charcoal 25-50 grams; 1 g/kg for pediatrics.,AEMT,medium
56,Medical,Toxicology,Activated charcoal is contraindicated for:,Recent ingestions,Caustic ingestion altered LOC hydrocarbons,Aspirin overdose,Acetaminophen overdose,B,Contraindicated: caustics acids bases hydrocarbons metals altered LOC.,AEMT,medium
57,Medical,Toxicology,Opioid overdose causes:,Tachycardia and hypertension,Respiratory depression pinpoint pupils CNS depression,Dilated pupils,Seizures primarily,B,Opioid toxidrome: miosis respiratory depression decreased LOC.,AEMT,medium
58,Medical,Toxicology,Naloxone duration is shorter than most opioids meaning:,One dose is always enough,Patient may become re-sedated and need monitoring or repeat dose,No monitoring needed,Drug interactions,B,Naloxone lasts 30-90 minutes; watch for re-sedation.,AEMT,medium
59,Medical,Toxicology,Stimulant overdose signs include:,Pinpoint pupils bradycardia,Dilated pupils tachycardia hypertension agitation,Respiratory depression,Cold skin,B,Stimulants cocaine meth: mydriasis tachycardia HTN hyperthermia agitation.,AEMT,medium
60,Medical,Toxicology,Sedative overdose signs include:,Tachycardia and agitation,Respiratory depression decreased LOC,Dilated pupils,Hypertension,B,Sedative hypnotics: CNS depression respiratory depression hypotension.,AEMT,medium
61,Medical,Toxicology,Alcohol intoxication severe can cause:,Only euphoria,Respiratory depression aspiration hypothermia,Increased awareness,Hypertension,B,Severe intoxication: CNS depression respiratory depression aspiration risk.,AEMT,medium
62,Medical,Toxicology,Alcohol withdrawal can cause:,Only headache,Seizures tremors hallucinations DTs,No serious symptoms,Only nausea,B,Withdrawal can cause tremors seizures hallucinations delirium tremens.,AEMT,medium
63,Medical,Toxicology,Delirium tremens DTs is:,Minor withdrawal,Life-threatening alcohol withdrawal syndrome,Normal finding,Mild tremor,B,DTs is severe withdrawal with confusion agitation hallucinations autonomic instability.,AEMT,medium
64,Medical,Toxicology,Carbon monoxide binds to hemoglobin:,Less readily than oxygen,Much more readily than oxygen,Same as oxygen,Not at all,B,CO has 200-250x greater affinity for Hb than oxygen.,AEMT,medium
65,Medical,Toxicology,Carbon monoxide poisoning source is often:,Outdoor air,Faulty furnace car exhaust fire smoke,Water,Food,B,CO from combustion: furnaces heaters vehicles fire generators.,AEMT,medium
66,Medical,Behavioral,Medical causes of altered behavior include:,None,Hypoglycemia hypoxia head injury drugs,Only psychiatric illness,Only drug use,B,Always consider medical causes: glucose hypoxia trauma infection drugs.,AEMT,medium
67,Medical,Behavioral,Organic causes of behavioral emergency should be:,Ignored,Ruled out before assuming psychiatric cause,Treated psychiatrically,Never considered,B,Always consider medical organic causes that may be treatable.,AEMT,medium
68,Medical,Behavioral,Depression signs may include:,Mania,Sadness hopelessness sleep changes appetite changes,Euphoria,Hyperactivity,B,Depression: persistent sadness hopelessness sleep appetite and energy changes.,AEMT,medium
69,Medical,Behavioral,Suicidal patients should:,Be ignored,Be taken seriously with direct questions about intent,Never be asked about suicide,Be left alone,B,Take seriously ask direct questions about suicidal thoughts plans means.,AEMT,medium
70,Medical,Behavioral,Risk factors for suicide include:,Happiness,Previous attempts depression substance abuse access to means,Youth alone,Stable employment,B,Risks: previous attempts mental illness substance abuse loss of access to weapons.,AEMT,medium
71,Medical,Behavioral,When restraints are used:,Leave patient unmonitored,Monitor continuously especially breathing,Use maximum force,Restrain prone,B,Continuous monitoring; never prone restrain; check circulation breathing.,AEMT,medium
72,Medical,Behavioral,Chemical restraint refers to:,Physical restraints,Medications used to calm agitated patients,Handcuffs,Straps only,B,Chemical restraint uses medications to control agitated behavior.,AEMT,medium
73,Medical,Environmental,Heat cramps are:,Most severe heat illness,Muscle cramps from heat and dehydration,Life-threatening,Always require IV,B,Heat cramps are painful spasms usually from fluid and electrolyte loss.,AEMT,medium
74,Medical,Environmental,Heat cramps treatment:,Rapid cooling,Move to cool area oral fluids rest,IV fluids always,Ignore them,B,Treat with cool environment rest and oral electrolyte fluids.,AEMT,medium
75,Medical,Environmental,Heat exhaustion presents with:,Hot dry skin,Heavy sweating weakness normal or slightly elevated temp,Seizures,Unconsciousness,B,Heat exhaustion: sweating weakness nausea temp usually less than 104F.,AEMT,medium
76,Medical,Environmental,Heat exhaustion treatment:,Active cooling only,Move to cool area remove clothing fluids rest,No treatment needed,Warm fluids,B,Cool environment remove excess clothing oral or IV fluids rest.,AEMT,medium
77,Medical,Environmental,Heat stroke is characterized by:,Heavy sweating,Hot skin often dry altered mental status high temp,Mild symptoms,Normal temperature,B,Heat stroke: core temp greater than 104F altered LOC often no sweating.,AEMT,medium
78,Medical,Environmental,Heat stroke is a:,Minor illness,Life-threatening emergency,Self-limiting condition,Mild condition,B,Heat stroke is true emergency; can cause organ damage death.,AEMT,medium
79,Medical,Environmental,Heat stroke cooling methods include:,Slow cooling,Cold water ice packs evaporative cooling,Warm blankets,No cooling needed,B,Aggressive cooling: cold water immersion ice packs to neck groin axilla.,AEMT,medium
80,Medical,Environmental,Mild hypothermia temperature range:,Below 82°F,90-95°F 32-35°C,Below 80°F,98-100°F,B,Mild hypothermia: 90-95°F; shivering present.,AEMT,medium
81,Medical,Environmental,Moderate hypothermia temperature range:,95-98°F,82-90°F 28-32°C,Below 80°F,70-80°F,B,Moderate hypothermia: 82-90°F; shivering may stop.,AEMT,medium
82,Medical,Environmental,Severe hypothermia temperature range:,90-95°F,Below 82°F 28°C,85-90°F,93-95°F,B,Severe hypothermia: below 82°F; cardiac instability risk.,AEMT,medium
83,Medical,Environmental,Shivering stops in hypothermia when:,Patient warms up,Temperature drops below approximately 86-90°F,Patient is comfortable,Treatment is effective,B,Shivering typically stops around 86-90°F as compensatory mechanisms fail.,AEMT,medium
84,Medical,Environmental,Hypothermia treatment includes:,Active external rewarming always,Remove wet clothing insulate prevent further heat loss,Cold IV fluids,No treatment,B,Remove wet clothes insulate passive rewarming; gentle handling.,AEMT,medium
85,Medical,Environmental,Rough handling of hypothermic patient may cause:,Improved warming,Cardiac arrhythmias,Faster recovery,No problems,B,Rough handling can trigger VF in severely hypothermic patients.,AEMT,medium
86,Medical,Environmental,Frostbite involves:,Only superficial skin,Freezing of tissue,Heat injury,Mild cold exposure,B,Frostbite is actual freezing of tissue causing cell damage.,AEMT,medium
87,Medical,Environmental,Frostbite treatment in field:,Rub with snow,Protect from further injury do not rub or use direct heat,Rapid rewarming,Hot water immersion,B,Protect area do not rub; rewarm only if no refreezing risk.,AEMT,medium
88,Medical,Environmental,Near drowning treatment focuses on:,Abdominal thrusts,Ventilation and oxygenation,Chest thrusts first,Heimlich maneuver,B,Focus on oxygenation ventilation; do not delay for water removal.,AEMT,medium
89,Medical,Environmental,Diving emergencies may include:,Only drowning,Decompression sickness air embolism,Only trauma,No special conditions,B,Diving emergencies: barotrauma decompression sickness arterial gas embolism.,AEMT,medium
90,Medical,Environmental,Decompression sickness bends results from:,Deep breath-hold diving,Nitrogen bubbles forming during rapid ascent,Shallow water,Slow ascent,B,Rapid ascent causes dissolved nitrogen to form bubbles in blood and tissues.,AEMT,medium
91,Medical,Infectious,Universal precautions assume:,Some patients are infectious,All blood and body fluids are potentially infectious,Only bleeding patients are infectious,Only sick patients are infectious,B,Treat all blood and body fluids as potentially infectious.,AEMT,medium
92,Medical,Infectious,Airborne transmission requires:,Contact,Inhalation of small particles that remain suspended,Droplets,Touch,B,Airborne pathogens TB measles chickenpox travel on small particles.,AEMT,medium
93,Medical,Infectious,Droplet transmission requires:,Close contact with respiratory secretions,Airborne particles,Needle sticks,Surface contact,A,Droplets larger particles travel short distance require close contact.,AEMT,medium
94,Medical,Infectious,N95 respirator is used for:,All patients,Airborne precautions TB,Droplet precautions only,No specific use,B,N95 filters airborne particles; used for TB suspected and other airborne diseases.,AEMT,medium
95,Medical,Infectious,TB tuberculosis is transmitted by:,Contact,Airborne route,Food,Water,B,TB spreads through airborne droplet nuclei from coughing.,AEMT,medium
96,Medical,Infectious,Hepatitis B is transmitted by:,Airborne route,Blood and body fluids,Food,Casual contact,B,Hepatitis B transmitted through blood sexual contact perinatal.,AEMT,medium
97,Medical,Infectious,HIV is transmitted by:,Casual contact,Blood sexual contact perinatal,Airborne route,Mosquito bites,B,HIV transmission: blood body fluids sexual contact mother to child.,AEMT,medium
98,Medical,Infectious,After exposure to blood or body fluids:,Ignore it,Wash immediately report and seek evaluation,Wait until end of shift,No action needed,B,Immediately wash exposed area report incident seek medical evaluation.,AEMT,medium
99,Medical,Infectious,Signs of sepsis include:,Localized infection only,Fever tachycardia tachypnea altered mental status hypotension,Bradycardia,Normal vital signs,B,Sepsis: systemic response to infection with vital sign abnormalities and organ dysfunction.,AEMT,medium
