id,category,subcategory,question,option_a,option_b,option_c,option_d,correct_answer,rationale,certification,difficulty
89,OB/Peds,Pediatric Shock,A febrile child has HR 190 BP 60/30 mottled skin and is lethargic. Diagnosis:,Dehydration,Septic shock,Cardiogenic shock,Hypovolemic shock,B,Febrile child with hypotension and altered perfusion: septic shock. Aggressive fluid resuscitation.,Paramedic,medium
90,OB/Peds,Pediatric Shock,Treatment for pediatric septic shock:,10 mL/kg fluid,20 mL/kg fluid push repeat up to 60 mL/kg then vasopressors,Vasopressors first,No fluid resuscitation,B,Pediatric sepsis: aggressive fluid 20 mL/kg push may repeat to 60 mL/kg then pressors if refractory.,Paramedic,medium
91,OB/Peds,Pediatric Shock,A child with a history of congenital heart disease is cyanotic and hypotensive at 1 week of age. Suspect:,Simple heart defect,Ductal-dependent cardiac lesion as ductus closes,Sepsis only,Dehydration,B,Neonate with cyanosis and shock as PDA closes: duct-dependent lesion. May need prostaglandin.,Paramedic,medium
92,OB/Peds,Pediatric Shock,Prostaglandin E1 PGE1 is given for suspected duct-dependent cardiac lesion to:,Close the ductus,Keep ductus arteriosus open,Improve contractility,Reduce fever,B,PGE1: maintains ductal patency until surgical intervention. Side effects include apnea.,Paramedic,medium
93,OB/Peds,Special,A pregnant patient with gestational diabetes has a term infant that is very large and floppy. Glucose is 28. This is:,Normal for infant of diabetic mother,Neonatal hypoglycemia from maternal hyperglycemia causing fetal hyperinsulinism,Sepsis,Normal glucose,B,IDM: fetal hyperinsulinism from maternal hyperglycemia causes neonatal hypoglycemia after delivery.,Paramedic,medium
94,OB/Peds,Special,Treatment for neonatal hypoglycemia:,D50 IV push,D10 2-4 mL/kg IV or early feeding if able,Glucagon only,Observation,B,Neonatal hypoglycemia: D10 2-4 mL/kg IV. D50 is too concentrated for neonates.,Paramedic,medium
95,OB/Peds,Special,A newborn has copious oral secretions and chokes with first feeding attempt. Catheter cannot pass to stomach. Suspect:,Normal newborn,Tracheoesophageal fistula or esophageal atresia,Pyloric stenosis,Normal feeding difficulty,B,TEF/EA: excessive secretions unable to pass NG choking with feeds. Surgical emergency.,Paramedic,medium
96,OB/Peds,Special,A 3-week-old has projectile non-bilious vomiting after feeds and wants to feed again. Most likely diagnosis:,GERD,Pyloric stenosis,Intestinal obstruction,Malrotation,B,Pyloric stenosis: projectile non-bilious vomiting hungry infant olive mass in RUQ.,Paramedic,medium
97,OB/Peds,Special,A 2-week-old has bilious green vomiting and abdominal distension. This is:,Normal spitting up,Intestinal obstruction possibly malrotation with volvulus,Pyloric stenosis,GERD,B,Bilious vomiting in neonate: intestinal obstruction until proven otherwise. Malrotation with volvulus is surgical emergency.,Paramedic,medium
98,OB/Peds,Special,A child with previous cardiac surgery has fever lethargy and poor feeding. Mother mentions he had dental work recently. Concern:,Teething,Bacterial endocarditis,Viral illness,Normal post-procedure,B,CHD with dental procedure and fever: suspect endocarditis. Dental procedures can cause bacteremia.,Paramedic,medium
99,OB/Peds,Special,A 12-year-old with sickle cell disease has fever and appears toxic. Of particular concern:,Simple infection,Overwhelming sepsis from encapsulated organisms due to functional asplenia,Viral syndrome,Sickle crisis,B,Sickle cell patients are functionally asplenic: high risk for encapsulated organism sepsis strep pneumo.,Paramedic,medium
