id,category,subcategory,question,option_a,option_b,option_c,option_d,correct_answer,rationale
19,Neurology,Altered Mental Status,A 78-year-old female is brought from a nursing home for confusion. Staff states she was her normal self yesterday but today does not recognize them and is talking to people who are not there. She has a history of dementia hypertension and diabetes. Her baseline is oriented to person only and ambulatory with a walker. Today she is disoriented to person place and time and is picking at the air. Vital signs are BP 108/62 HR 102 RR 22 SpO2 94% on room air Temp 101.2F. What is the most likely cause of her acute change and how does delirium differ from dementia?,She has worsening dementia which is expected to fluctuate,She has delirium superimposed on dementia. Delirium is acute fluctuating and indicates an underlying medical cause such as infection. The fever and tachycardia suggest UTI or pneumonia,This is normal for someone with dementia,She is having a psychiatric emergency,B,Delirium is an acute confusional state characterized by fluctuating attention and awareness with rapid onset over hours to days. It indicates an underlying medical problem. Dementia is chronic progressive cognitive decline developing over months to years. Patients with dementia are at high risk for delirium from infections medications metabolic disturbances and other medical issues. This patient's acute change from baseline with fever tachycardia and borderline hypotension suggests infection likely UTI or pneumonia given her age and setting. She needs evaluation for the underlying cause not just treatment of confusion.
20,Neurology,Altered Mental Status,A 52-year-old male is found confused in his office. Coworkers state he was fine this morning but became increasingly confused and combative over the past 2 hours. He has no medical history that they know of. On exam he is diaphoretic with tremor of his hands. He is disoriented and agitated swatting at your hands when you try to examine him. Vital signs are BP 98/62 HR 118 RR 20 SpO2 98% on room air. Pupils are 4mm and reactive. Blood glucose is 38 mg/dL. What is the cause of his altered mental status and what is the treatment?,He is having a stroke and needs immediate CT scan,He has severe hypoglycemia causing neuroglycopenic symptoms. Treatment is IV dextrose D50 25g or 50mL followed by repeat glucose check,He is intoxicated and needs supportive care only,He is having a panic attack,B,Hypoglycemia causes altered mental status through two mechanisms. Autonomic symptoms from sympathetic activation include diaphoresis tremor tachycardia anxiety and hunger. Neuroglycopenic symptoms from brain glucose deprivation include confusion bizarre behavior combativeness seizures and coma. The brain depends on glucose and symptoms progress as levels fall. Treatment is glucose replacement with IV dextrose D50 25g for adults oral glucose if patient can swallow safely or glucagon 1mg IM if no IV access. Always check glucose in any patient with altered mental status as hypoglycemia is reversible but can cause permanent brain damage if prolonged.
21,Neurology,Altered Mental Status,A 67-year-old male presents with gradual onset of confusion over several days. His wife states he has been increasingly forgetful sleepy and unsteady on his feet. He fell yesterday. He has a history of atrial fibrillation and takes warfarin. He drinks 2-3 beers daily. On exam he is oriented to person only with slow speech. He has mild right arm weakness. Vital signs are normal. What diagnosis must be considered given his anticoagulation use and mechanism of mental status change?,Normal pressure hydrocephalus,Subdural hematoma. Elderly patients on anticoagulation are at high risk and may have minimal or no trauma history. Symptoms develop gradually over days to weeks,Wernicke encephalopathy from alcohol,Urinary tract infection causing confusion,B,Subdural hematoma occurs when bridging veins tear between the brain and dura. In elderly patients with brain atrophy these veins are stretched and vulnerable to injury from even minor trauma. Anticoagulation dramatically increases risk and patients may not recall any trauma. Symptoms develop gradually over days to weeks as the hematoma slowly expands including headache confusion personality changes and focal deficits. The triad of dementia gait disturbance and incontinence can mimic normal pressure hydrocephalus. CT scan will show crescent-shaped collection along the brain surface. Treatment may require surgical evacuation and anticoagulation reversal.
22,Neurology,Headache,A 35-year-old female presents with severe unilateral throbbing headache behind her right eye that began 4 hours ago. She has nausea and has vomited once. Light and sound make the headache worse so she has been lying in a dark quiet room. She has had similar headaches before usually around her menstrual period. She took ibuprofen without relief. She has no fever or neck stiffness. Vital signs are BP 128/78 HR 76 RR 14 SpO2 99%. Neurological exam is normal. What type of headache is this and what treatments are appropriate?,Tension headache treated with acetaminophen,Migraine headache. Appropriate treatments include antiemetics like ondansetron or metoclopramide and analgesics like ketorolac. Triptans are also effective if available,Cluster headache treated with high-flow oxygen,Meningitis requiring immediate antibiotics,B,Migraine headaches are characterized by unilateral throbbing pain of moderate to severe intensity lasting 4-72 hours with associated nausea vomiting photophobia and phonophobia. They are often triggered by hormonal changes stress foods or sleep disturbance. Treatment in the acute setting includes antiemetics like ondansetron 4mg IV or metoclopramide 10mg IV and analgesics like ketorolac 15-30mg IV. Triptans like sumatriptan are migraine-specific medications that are highly effective if given early. Dark quiet environment and IV fluids for dehydration from vomiting are supportive measures.
23,Neurology,Headache,A 42-year-old male presents with excruciating pain around his right eye that began 30 minutes ago. He is pacing and agitated unable to sit still. He states the pain is stabbing and rates it 10 out of 10. His right eye is red and tearing and his right nostril is congested and running. He has had similar episodes over the past two weeks always on the right side lasting about an hour each. Vital signs are normal. What type of headache is this and what is the most effective prehospital treatment?,Migraine headache treated with IV ketorolac and ondansetron,Cluster headache. High-flow oxygen 12-15 LPM via non-rebreather is highly effective and should be administered immediately,Tension headache treated with massage and relaxation,Glaucoma requiring immediate ophthalmology consult,B,Cluster headaches are characterized by severe unilateral orbital or temporal pain lasting 15-180 minutes occurring in clusters over weeks to months followed by remission periods. Unlike migraines patients are often agitated and pacing rather than lying still. Autonomic symptoms are ipsilateral to the pain and include lacrimation conjunctival injection nasal congestion rhinorrhea ptosis and miosis. High-flow oxygen 12-15 LPM via non-rebreather is first-line treatment and provides relief within 15 minutes in 70% of patients. The mechanism involves vasoconstriction and inhibition of trigeminal activation. Triptans are also effective.
24,Neurology,Headache,A 58-year-old female presents with new onset headache over the past 3 weeks that is worse in the morning and when lying down. She has vomited several times particularly in the morning. She reports her vision has been blurry and she has noticed a change in her personality per her husband. She has no headache history. Vital signs are BP 148/88 HR 72 RR 16 SpO2 98%. On exam she has papilledema on fundoscopic examination and mild left arm weakness. What is the most likely cause of her headache?,New onset migraine,Intracranial mass lesion causing increased intracranial pressure. The progressive headache worse with recumbency morning vomiting papilledema focal deficit and personality change all suggest space-occupying lesion,Tension headache from stress,Medication overuse headache,B,New onset headache in middle-aged or older adults should raise concern for secondary causes. Red flags in this case include progressive worsening worse when supine due to increased ICP when lying flat morning vomiting from ICP increase during sleep papilledema indicating chronic elevated ICP focal neurological deficit and personality change. This constellation strongly suggests an intracranial mass lesion such as primary brain tumor or metastasis. She needs urgent CT or MRI imaging. If significant mass effect is present avoid actions that increase ICP and be prepared for possible herniation.
25,Neurology,Increased ICP,A 22-year-old male was involved in a motorcycle crash with significant head trauma. He was initially conscious at the scene but is now unresponsive. He is intubated for airway protection. On exam his left pupil is 7mm and fixed while the right is 3mm and reactive. He has extensor posturing to painful stimuli. Vital signs are BP 178/102 HR 58 RR being ventilated. What do these findings indicate and what is Cushing triad?,He has a cervical spine injury causing these findings,He has signs of uncal herniation with Cushing triad which is hypertension bradycardia and irregular respirations indicating severely elevated ICP with brainstem compression,These vital signs indicate hypovolemic shock,The unequal pupils indicate direct eye trauma only,B,Uncal herniation occurs when increased ICP forces the medial temporal lobe uncus through the tentorial notch compressing the midbrain and third cranial nerve. The ipsilateral pupil dilates due to CN3 compression and becomes fixed. Extensor posturing decerebrate indicates midbrain dysfunction. Cushing triad consists of hypertension widened pulse pressure bradycardia and irregular respirations. These are late signs indicating life-threatening ICP elevation and imminent brainstem death. Management includes elevating head of bed maintaining MAP for cerebral perfusion avoiding hypoxia and hypotension and brief hyperventilation to EtCO2 30-35 only if herniation signs are present.
26,Neurology,Increased ICP,You are managing the head-injured patient with signs of herniation. He is intubated and you are ventilating him. Your partner reports EtCO2 of 45 mmHg. What is the target EtCO2 for this patient and what is the rationale for brief hyperventilation in herniation?,Maintain EtCO2 at 45 mmHg which is normal,Target EtCO2 30-35 mmHg only if herniation signs are present. Hyperventilation causes cerebral vasoconstriction reducing ICP but also reduces cerebral blood flow so it is only used as temporizing measure for active herniation,Hyperventilate to EtCO2 of 20 mmHg to maximize ICP reduction,Hypoventilate to EtCO2 of 55 mmHg,B,Hyperventilation reduces PaCO2 which causes cerebral vasoconstriction decreasing cerebral blood volume and ICP. However excessive vasoconstriction reduces cerebral blood flow potentially worsening ischemia. Routine prophylactic hyperventilation worsens outcomes. Brief moderate hyperventilation to EtCO2 30-35 mmHg is reserved for patients with signs of active herniation as a temporizing measure until definitive treatment. Target EtCO2 for head-injured patients without herniation is 35-40 mmHg. Other ICP management includes head elevation to 30 degrees sedation avoiding hyperthermia and maintaining adequate MAP.
27,Neurology,Increased ICP,A 45-year-old female with a brain tumor presents with sudden severe headache vomiting and decreasing level of consciousness. Her family states she was fine yesterday. She is now responsive only to painful stimuli. Her left pupil is dilating. The neurosurgeon requests you give mannitol during transport. What is mannitol and what is its mechanism of action for reducing ICP?,Mannitol is an antibiotic that treats brain infections,Mannitol is an osmotic diuretic that draws water from brain tissue into the vasculature reducing cerebral edema and ICP. Dose is 0.5-1 g/kg IV over 15-20 minutes,Mannitol is a paralytic agent that reduces brain metabolic demand,Mannitol is a vasodilator that improves brain blood flow,B,Mannitol is an osmotic diuretic that does not cross the intact blood-brain barrier. It creates an osmotic gradient that draws water from brain tissue into the vasculature reducing cerebral edema and ICP. Effects begin within 15-30 minutes and peak at 1 hour. Dose is 0.5-1 g/kg IV typically as 20% solution given over 15-20 minutes. It is used as a temporizing measure in patients with signs of increased ICP and impending herniation. Side effects include hypotension from diuresis and electrolyte disturbances. It requires intact kidney function for excretion. Hypertonic saline 3% or 23.4% is an alternative osmotic agent.
28,Neurology,Spinal Cord Injury,A 25-year-old male dove into shallow water at a lake and struck his head on the bottom. Friends pulled him from the water and he is now on the beach. He is awake and states he cannot move or feel his arms or legs. He has neck pain. Vital signs are BP 82/50 HR 54 RR 14 SpO2 94% on room air. His skin is warm and dry. What type of shock is he experiencing and what is the underlying mechanism?,Hypovolemic shock from internal bleeding,Neurogenic shock from spinal cord injury causing loss of sympathetic tone. This results in vasodilation and bradycardia,Cardiogenic shock from cardiac contusion,Septic shock from aspiration,B,Neurogenic shock occurs when spinal cord injury above T6 disrupts sympathetic outflow causing loss of vascular tone and unopposed vagal activity. Signs include hypotension with bradycardia which distinguishes it from hypovolemic shock which causes tachycardia and warm dry skin from vasodilation rather than cold clammy skin of hypovolemia. This patient likely has a cervical spine injury causing quadriplegia and neurogenic shock. Treatment includes spinal immobilization IV fluids to treat hypotension and vasopressors like norepinephrine if fluids are insufficient. Atropine may be needed for symptomatic bradycardia.
29,Neurology,Spinal Cord Injury,The patient from the diving accident has been immobilized and you are transporting. He has weakness in both arms with hands weaker than shoulders and has some leg movement. Sensation is decreased in a cape-like distribution over shoulders and arms but intact in the legs. This pattern suggests incomplete spinal cord injury. What specific syndrome does this pattern suggest?,Anterior cord syndrome,Central cord syndrome with greater upper extremity weakness than lower extremity due to central gray matter injury. This typically occurs with hyperextension injuries,Brown-Sequard syndrome,Cauda equina syndrome,B,Central cord syndrome is the most common incomplete spinal cord injury. It occurs when damage primarily affects the central gray matter of the cervical spinal cord typically from hyperextension injuries. Because motor fibers to the arms are located more centrally in the corticospinal tracts than those to the legs arm weakness is greater than leg weakness. Sensory findings vary but may include a cape-like distribution. Central cord syndrome has the best prognosis of incomplete injuries with many patients regaining significant function particularly in the lower extremities. Bowel and bladder function often recovers as well.
30,Neurology,Spinal Cord Injury,A 32-year-old male was assaulted and stabbed in the back of the neck on the right side. He has weakness and loss of position sense in his right arm and leg but preserved pain and temperature sensation on the right. He has loss of pain and temperature sensation on the left side but strength and position sense are intact on the left. Vital signs are stable. What spinal cord syndrome does this represent?,Complete cord transection,Brown-Sequard syndrome or cord hemisection. Ipsilateral motor and proprioception loss with contralateral pain and temperature loss,Central cord syndrome,Anterior cord syndrome,B,Brown-Sequard syndrome results from hemisection or lateral injury to one side of the spinal cord often from penetrating trauma. The findings reflect the anatomy of spinal cord tracts. The corticospinal motor tract and dorsal columns proprioception and vibration have ipsilateral function meaning they do not cross until the brainstem so damage causes ipsilateral deficits. The spinothalamic tract pain and temperature crosses within 1-2 levels of entering the cord so damage causes contralateral deficits. Brown-Sequard syndrome has the best prognosis of all incomplete cord injuries with most patients regaining ambulatory function.
31,Neurology,Spinal Cord Injury,A 68-year-old male with ankylosing spondylitis is brought in after a fall from standing height. He fell backward and hit his head. He complains of severe neck pain and has weakness in all four extremities. He is having difficulty breathing with shallow respirations. Vital signs are BP 88/54 HR 52 RR 24 shallow SpO2 88% on room air. His spine is rigid and fused in a flexed position. Why is this patient at high risk for spinal cord injury and what is the respiratory concern?,His fused spine is protective and he is low risk,Ankylosing spondylitis causes brittle fused spine that fractures easily even from minor trauma. Cervical injury can affect phrenic nerve C3-5 causing diaphragmatic paralysis and respiratory failure,He has pneumonia from aspiration,His respiratory difficulty is from anxiety only,B,Ankylosing spondylitis causes spinal fusion with rigid brittle bones highly susceptible to fracture from even minor trauma. The fused spine acts like a long bone that can fracture at any point. These patients often have cervical involvement and even low-energy falls can cause unstable cervical fractures with cord injury. Respiratory difficulty from cord injury indicates high cervical involvement affecting the phrenic nerve C3-C5 which innervates the diaphragm. Loss of diaphragmatic function causes respiratory failure. Immobilization is challenging due to fixed kyphosis and may require padding to accommodate deformity.
32,Neurology,Spinal Cord Injury,You are caring for a patient with a known T4 spinal cord injury who lives in a group home. Staff called because he developed severe headache flushing above his nipple line profuse sweating and his blood pressure is 220/130. Heart rate is 48. He is anxious and complaining the headache is unbearable. Staff removed a kink in his urinary catheter just before symptoms began. What is this condition and what is the immediate management?,Hypertensive emergency from medication noncompliance,Autonomic dysreflexia which is a life-threatening hypertensive emergency in patients with injuries at T6 or above. Immediately sit him upright loosen clothing and identify and remove the noxious stimulus which was the kinked catheter,Stroke from the high blood pressure,Panic attack causing the symptoms,B,Autonomic dysreflexia AD occurs in patients with spinal cord injuries at T6 or above. A noxious stimulus below the injury level triggers massive sympathetic discharge that cannot be modulated due to the cord injury. This causes severe hypertension that can lead to stroke seizures or death. Common triggers include bladder distension from catheter obstruction fecal impaction pressure ulcers and tight clothing. Symptoms include pounding headache flushing and sweating above the injury level and piloerection. Management is to sit the patient upright immediately to lower BP and identify and remove the triggering stimulus. If BP remains severely elevated antihypertensives may be needed.
33,Neurology,Meningitis,A 19-year-old male college student presents with fever severe headache and stiff neck that developed over the past 24 hours. He has vomited several times and the light hurts his eyes. His roommate was diagnosed with meningitis yesterday. On exam he has temp 103.2F and cannot flex his neck to his chest due to pain. He has a petechial rash on his trunk and extremities. Vital signs are BP 92/58 HR 128 RR 24 SpO2 96%. What type of meningitis is most likely and what is the significance of the rash?,Viral meningitis which requires supportive care only,Bacterial meningitis likely meningococcal given the petechial rash which indicates meningococcemia with sepsis and possible DIC. This is a medical emergency requiring immediate antibiotics and droplet precautions,Fungal meningitis,Migraine with photophobia,B,This patient has classic bacterial meningitis presenting with fever headache neck stiffness photophobia and vomiting. The petechial and purpuric rash is highly concerning for meningococcal meningitis Neisseria meningitidis. The rash indicates meningococcemia where bacteria are in the bloodstream and can progress rapidly to purpura fulminans DIC and Waterhouse-Friderichsen syndrome adrenal hemorrhage. This is a medical emergency with high mortality. Apply droplet precautions mask begin IV fluids for sepsis and transport emergently. In some systems prehospital antibiotics are administered.
34,Neurology,Meningitis,You are transporting the patient with suspected meningococcal meningitis. Your partner is concerned about personal exposure. What precautions are appropriate and what prophylaxis might be needed for close contacts?,No precautions needed as meningitis is not contagious,Droplet precautions with surgical mask on patient and N95 or surgical mask on providers within 3 feet. Close contacts including EMS crew may need antibiotic prophylaxis with rifampin ciprofloxacin or ceftriaxone,Full airborne precautions with N95 and negative pressure,Contact precautions with gown and gloves only,B,Neisseria meningitidis is transmitted via respiratory droplets requiring droplet precautions. Place a surgical mask on the patient and providers should wear surgical masks or N95 when within 3 feet. Close contacts which includes household members roommates and healthcare workers with direct exposure to respiratory secretions should receive antibiotic prophylaxis. Options include rifampin 600mg BID for 2 days ciprofloxacin 500mg single dose or ceftriaxone 250mg IM single dose. Prophylaxis should be given within 24 hours of exposure and up to 10-14 days after exposure. Notify your supervisor and infection control about the exposure.
35,Neurology,Encephalitis,A 45-year-old male presents with confusion fever and bizarre behavior that has developed over the past 3 days. His wife states he has been acting strangely saying things that do not make sense having visual hallucinations and had a seizure this morning. He had flu-like symptoms a week ago. On exam he is disoriented with fever of 102F and has involuntary lip-smacking movements. He cannot follow commands consistently. Vital signs are otherwise stable. What condition is most likely and what area of the brain is typically affected?,Bacterial meningitis,Viral encephalitis most commonly herpes simplex encephalitis which has predilection for the temporal lobes causing psychiatric symptoms memory impairment and seizures,Drug intoxication,Schizophrenia with new onset psychosis,B,Encephalitis is inflammation of the brain parenchyma itself usually from viral infection. Herpes simplex virus HSV is the most common cause of sporadic encephalitis and has predilection for the temporal lobes. Symptoms include fever headache altered mental status personality and behavioral changes seizures and focal neurological deficits. Temporal lobe involvement causes psychiatric symptoms memory impairment and automatisms like lip smacking. This differs from meningitis which primarily causes meningeal irritation with neck stiffness. HSV encephalitis requires urgent treatment with IV acyclovir as delayed treatment increases mortality and neurological sequelae.
36,Neurology,Peripheral Neuropathy,A 52-year-old female presents with progressive weakness over the past week. It started with tingling in her feet and has ascended to involve her legs and now her arms. She had a respiratory infection 2 weeks ago. She is having difficulty walking and raising her arms. Her voice sounds nasal. On exam she has symmetric weakness in all extremities worse distally with absent deep tendon reflexes. Sensation is intact. Vital signs show RR 22 with shallow breathing. She cannot count to 20 on one breath. What condition is this and what is the primary concern?,Stroke causing bilateral weakness,Guillain-Barré syndrome an ascending paralysis that can cause respiratory failure from diaphragmatic weakness. The breathing difficulty is an emergency requiring close monitoring and possible intubation,Multiple sclerosis flare,Myasthenia gravis crisis,B,Guillain-Barré syndrome GBS is an acute inflammatory demyelinating polyneuropathy causing ascending symmetric weakness with areflexia. It often follows viral infection by 1-4 weeks due to molecular mimicry triggering autoimmune attack on peripheral nerves. Sensory symptoms are typically mild compared to motor weakness. The critical concern is respiratory failure as weakness ascends to involve respiratory muscles. Inability to count to 20 or 10 on one breath negative inspiratory force less than 20 cmH2O or vital capacity less than 15 mL/kg indicates impending respiratory failure. Many patients require intubation. Treatment in hospital includes IVIG or plasmapheresis.
