id,category,subcategory,question,option_a,option_b,option_c,option_d,correct_answer,rationale
1,Neurology,Stroke Assessment,You respond to a 68-year-old male who was eating breakfast when his wife noticed his face looked droopy on one side. He tried to speak but his words were slurred and he could not lift his right arm. His wife called 911 immediately and states symptoms began exactly 45 minutes ago. He has a history of hypertension atrial fibrillation and type 2 diabetes. His medications include metoprolol warfarin metformin and lisinopril. Vital signs are BP 178/96 HR 88 irregular RR 16 SpO2 97% on room air. On exam he has right facial droop with forehead sparing right arm weakness with drift and dysarthria. What is the significance of the forehead sparing in his facial droop?,Forehead sparing indicates the facial weakness is from a peripheral nerve injury like Bell palsy,Forehead sparing indicates an upper motor neuron lesion consistent with stroke because the forehead receives bilateral cortical innervation,Forehead sparing means this is not a stroke,The forehead is always spared in facial weakness,B,The forehead muscles receive innervation from both cerebral hemispheres so a stroke affecting one hemisphere will spare forehead movement because the other hemisphere can still innervate those muscles. In contrast peripheral facial nerve palsy like Bell palsy affects the entire half of the face including forehead because all fibers to that side travel through the damaged nerve. This patient's presentation with forehead-sparing facial droop arm weakness and dysarthria is classic for acute stroke. The atrial fibrillation is a major risk factor for cardioembolic stroke.
2,Neurology,Stroke Assessment,Continuing with the previous patient you perform a stroke assessment using the Cincinnati Prehospital Stroke Scale. What are the three components of this scale and what is the significance of an abnormal finding?,Arm drift speech and pupil response. One abnormality suggests possible stroke,Facial droop arm drift and speech. One abnormality has 72% probability of stroke and all three abnormal has greater than 85% probability,Blood pressure heart rate and oxygen saturation,Pupil response grip strength and verbal response,B,The Cincinnati Prehospital Stroke Scale assesses three components: facial droop by asking patient to smile arm drift by having patient hold arms out with eyes closed and speech by having patient repeat a sentence. If any one component is abnormal there is a 72% probability of stroke. If all three are abnormal probability exceeds 85%. This simple rapid assessment helps identify stroke patients who may benefit from time-sensitive interventions like thrombolytics. This patient has all three components abnormal making stroke highly likely.
3,Neurology,Stroke Assessment,You are transporting the stroke patient to a comprehensive stroke center 25 minutes away. Medical control asks for the NIHSS score but you have not been trained in this assessment. They instead ask for the LAMS score. The patient has facial droop cannot hold his right arm up at all and cannot grip with his right hand. He has no leg weakness. What is the LAMS score and what does it indicate?,LAMS 0 indicating minor stroke,LAMS 4 indicating likely large vessel occlusion requiring thrombectomy evaluation,LAMS 10 indicating massive stroke,LAMS cannot be calculated without CT scan,B,The Los Angeles Motor Scale LAMS is a prehospital tool to identify large vessel occlusion LVO strokes that may benefit from mechanical thrombectomy. It scores facial droop 0-1 arm drift 0-2 and grip strength 0-2 for a total of 0-5. A score of 4 or greater suggests high probability of LVO. This patient scores 1 for facial droop 2 for arm falls immediately and 1 for weak grip for a total LAMS of 4 suggesting possible LVO. This information helps determine destination hospital as LVO strokes need comprehensive stroke centers capable of thrombectomy.
4,Neurology,Stroke Assessment,A 72-year-old female presents with sudden onset of difficulty speaking. Her husband states she was talking normally then suddenly began making sounds that do not make sense. She appears frustrated when trying to communicate. She can follow simple commands and has no facial droop or arm weakness. Vital signs are BP 168/94 HR 78 RR 16 SpO2 98% on room air. What type of aphasia is this patient demonstrating and what area of the brain is likely affected?,Receptive aphasia from damage to Wernicke area in the temporal lobe,Expressive aphasia from damage to Broca area in the frontal lobe. She understands but cannot produce meaningful speech,Global aphasia from damage to both language areas,Dysarthria from cerebellar damage,B,Expressive or Broca aphasia occurs when the patient understands language and knows what they want to say but cannot produce meaningful speech. Words may be garbled nonsensical or absent. Patients are often frustrated because they know they are not communicating properly. Broca area is located in the posterior inferior frontal lobe usually in the left hemisphere. In contrast receptive or Wernicke aphasia involves inability to understand language with fluent but meaningless speech production. This patient can follow commands indicating intact comprehension but cannot speak properly indicating expressive aphasia.
5,Neurology,Stroke Assessment,A 65-year-old male is found by his daughter who states she spoke to him on the phone 6 hours ago and he was fine. She found him on the floor unable to move his left side. He is awake but confused about what happened. She does not know exactly when symptoms began. Vital signs are BP 188/102 HR 82 RR 18 SpO2 96% on room air. He has left facial droop left arm and leg weakness with neglect of his left side. For time-sensitive stroke treatments what is the significance of the unknown time of onset?,Unknown time of onset does not affect treatment decisions,The last known well time is 6 hours ago which may exclude him from IV tPA but advanced imaging at the hospital may identify patients who can still benefit from thrombectomy,He cannot receive any stroke treatment because onset time is unknown,Assume onset was just before he was found and he is eligible for all treatments,B,For IV thrombolytics tPA the traditional window is 3 to 4.5 hours from symptom onset. When onset is unknown the last known well time is used which is 6 hours in this case placing him outside the tPA window. However mechanical thrombectomy can be performed up to 24 hours in select patients based on advanced imaging showing salvageable brain tissue. CT perfusion or MRI can identify mismatch between infarcted core and at-risk penumbra. This patient should still be transported emergently to a stroke center for imaging evaluation as he may benefit from thrombectomy despite the unknown onset time.
6,Neurology,Stroke Management,You are transporting a 58-year-old female with acute stroke symptoms that began 90 minutes ago. She has right-sided weakness and aphasia. Her blood pressure is 204/118. Medical control asks about blood pressure management. What are the blood pressure parameters for potential tPA candidates and what is the danger of aggressive blood pressure reduction in acute stroke?,Blood pressure should be lowered to normal 120/80 immediately,For tPA eligibility BP must be below 185/110. However aggressive BP reduction can worsen stroke by decreasing perfusion to ischemic penumbra,Blood pressure does not matter for stroke treatment,Higher blood pressure is always better in stroke,B,Blood pressure management in acute stroke is nuanced. For patients who may receive tPA blood pressure must be below 185/110 before administration and below 180/105 after. However aggressive blood pressure lowering is dangerous because elevated BP may be a compensatory mechanism to maintain perfusion to the ischemic penumbra. Dropping BP too quickly can extend the infarct. For patients not receiving tPA permissive hypertension up to 220/120 is generally allowed unless there is another indication for treatment like aortic dissection or hypertensive emergency with other end-organ damage.
7,Neurology,Stroke Management,A 70-year-old male had sudden onset of left-sided weakness and facial droop 2 hours ago. At the emergency department CT scan shows no hemorrhage. He is given IV tPA. During transport to the ICU he develops severe headache becomes less responsive and his right pupil becomes dilated and nonreactive. Blood pressure increases to 210/120 and heart rate drops to 52. What complication has likely occurred?,The tPA is working and the stroke is resolving,He has developed hemorrhagic transformation with intracerebral hemorrhage and possible herniation. The tPA should be stopped immediately and reversal agents considered,He is having a seizure,He is experiencing a migraine headache,B,Hemorrhagic transformation is the most feared complication of tPA occurring in approximately 6% of patients with symptomatic hemorrhage in about 2-3%. Signs include sudden neurological deterioration severe headache vomiting and signs of increased intracranial pressure. The dilated nonreactive pupil with Cushing triad of hypertension bradycardia and irregular respirations suggests uncal herniation from mass effect. Management includes stopping tPA immediately administering cryoprecipitate and tranexamic acid to reverse fibrinolysis emergent CT scan and neurosurgical consultation for possible hematoma evacuation.
8,Neurology,Stroke Types,A 55-year-old female presents with the worst headache of her life that began suddenly 3 hours ago while exercising. She describes it as a thunderclap headache that reached maximum intensity within seconds. She has vomited twice and has a stiff neck. She has no focal weakness. Vital signs are BP 168/98 HR 92 RR 18 SpO2 98% on room air. She is photophobic and has pain with neck flexion. What type of stroke is most likely and what is the underlying cause?,Ischemic stroke from carotid artery stenosis,Subarachnoid hemorrhage most commonly from ruptured cerebral aneurysm,Hemorrhagic stroke from hypertension,Transient ischemic attack,B,Subarachnoid hemorrhage SAH presents with sudden severe thunderclap headache often described as the worst headache of my life. The headache reaches maximum intensity within seconds unlike migraines which build over minutes to hours. Associated symptoms include nausea vomiting photophobia and meningismus neck stiffness due to blood irritating the meninges. The most common cause is rupture of a cerebral aneurysm. SAH can occur without focal deficits initially. Diagnosis is by CT scan which is 95% sensitive in first 24 hours followed by lumbar puncture if CT is negative. Rebleeding is a major concern with high mortality.
9,Neurology,Stroke Types,A 78-year-old male with a history of poorly controlled hypertension presents with sudden onset of severe headache left-sided weakness and decreasing level of consciousness over the past hour. His daughter states he was fine this morning then complained of headache and progressively became weaker and more confused. Vital signs are BP 228/134 HR 68 RR 14 SpO2 95% on room air. Left pupil is 6mm and sluggishly reactive. Right pupil is 3mm and reactive. He has dense left hemiplegia. What type of stroke is most likely and why is blood pressure management different than for ischemic stroke?,Ischemic stroke. Allow permissive hypertension to 220/120,Intracerebral hemorrhage from hypertension. Blood pressure should be reduced more aggressively to SBP less than 140 to reduce hematoma expansion,Subarachnoid hemorrhage. Blood pressure does not require treatment,Transient ischemic attack that is resolving,B,Intracerebral hemorrhage ICH presents with sudden focal neurological deficits progressive deterioration headache and signs of increased ICP. Hypertension is the most common cause with bleeding typically in the basal ganglia thalamus pons or cerebellum. The anisocoric pupils and declining consciousness suggest mass effect and possible early herniation. Unlike ischemic stroke where permissive hypertension preserves penumbral blood flow in ICH elevated BP promotes hematoma expansion. Current guidelines recommend SBP reduction to less than 140 mmHg for ICH patients presenting with SBP 150-220 using IV antihypertensives like nicardipine or labetalol.
10,Neurology,Stroke Types,A 62-year-old male presents with sudden onset of vertigo nausea vomiting difficulty walking and slurred speech. He has no headache or weakness. On exam he has horizontal nystagmus that is worse when looking to the left ataxic gait with falling to the left and dysarthria. Finger to nose testing shows dysmetria on the left. Vital signs are stable. He has a history of hypertension and diabetes. What area of the brain is likely affected and why is this presentation concerning?,This is benign positional vertigo and is not a stroke,This suggests a cerebellar stroke which is concerning because the posterior fossa is a confined space and cerebellar edema can cause brainstem compression and hydrocephalus,This is labyrinthitis and not a stroke,This is a migraine with aura,B,Cerebellar strokes present with vertigo ataxia nystagmus dysarthria and dysmetria without the hemiparesis seen in hemispheric strokes. The HINTS exam can help differentiate central from peripheral vertigo. Cerebellar strokes are particularly dangerous because the posterior fossa is a closed space. Cerebellar edema can compress the brainstem causing coma and death or obstruct CSF flow causing hydrocephalus. Patients can deteriorate rapidly and may require emergent suboccipital craniectomy. Any patient with acute vertigo and neurological findings should be evaluated for posterior circulation stroke.
11,Neurology,TIA,A 70-year-old female presents with right arm weakness and difficulty speaking that began 2 hours ago. Her symptoms have now completely resolved and she feels back to normal. She wants to refuse transport stating it was probably nothing since she feels fine. Her history includes hypertension hyperlipidemia and smoking. Vital signs are normal. On exam she has no deficits. What was the likely event and why should she be transported for evaluation despite symptom resolution?,She had a panic attack and does not need evaluation,She likely had a transient ischemic attack TIA which is a warning sign for impending stroke. Her 90-day stroke risk is significant and she needs urgent evaluation and risk factor modification,Since symptoms resolved she does not need any treatment,This was a migraine aura and is not concerning,B,A transient ischemic attack TIA is a brief episode of neurological dysfunction caused by focal brain ischemia without infarction. Symptoms typically resolve within minutes to hours. TIA is a medical emergency because it signals high near-term stroke risk. The ABCD2 score estimates risk based on age blood pressure clinical features duration and diabetes. This patient has multiple risk factors. Up to 10-15% of TIA patients will have a stroke within 90 days with highest risk in the first 48 hours. She needs urgent evaluation including brain imaging carotid evaluation cardiac monitoring and initiation of secondary prevention.
12,Neurology,Seizure Assessment,A 34-year-old male is found on the sidewalk having generalized tonic-clonic seizure activity. Bystanders state the shaking has been going on for approximately 5 minutes. He has no medical alert bracelet and no one knows his history. He is unconscious with rhythmic jerking of all extremities jaw clenched eyes deviated upward and incontinent of urine. He is cyanotic around the lips. Vital signs obtainable are HR 128 SpO2 82% on room air. What are your immediate management priorities?,Wait for the seizure to stop then assess the patient,Protect from injury maintain airway suction if needed provide oxygen and prepare to administer benzodiazepine if seizure continues. Check blood glucose,Restrain the patient to prevent injury and insert an oral airway,Perform CPR because he is cyanotic,B,Active seizure management priorities are protecting from injury by moving objects away and padding if possible maintaining airway positioning to prevent aspiration suctioning secretions providing supplemental oxygen and checking blood glucose as hypoglycemia can cause seizures. Do not restrain forcefully or insert anything into the mouth. If seizure continues beyond 5 minutes or recurs without recovery it is status epilepticus requiring benzodiazepine administration. The cyanosis is from respiratory muscle involvement during the tonic-clonic activity not cardiac arrest so CPR is not indicated.
13,Neurology,Seizure Assessment,The patient continues to seize. Glucose is 118 mg/dL. You establish IV access with difficulty due to the movement. The seizure has now lasted 8 minutes total. According to the definition of status epilepticus what medication should be administered and what is the first-line dose?,Phenytoin 20 mg/kg IV is first-line for all seizures,Benzodiazepine is first-line. Options include midazolam 10 mg IM or 5 mg IV lorazepam 4 mg IV or diazepam 10 mg IV,Phenobarbital 20 mg/kg IV is first-line,No medication should be given until EEG confirms seizure activity,B,Status epilepticus is traditionally defined as seizure activity lasting more than 5 minutes or recurrent seizures without return to baseline. Benzodiazepines are first-line treatment. IM midazolam 10 mg is as effective as IV lorazepam 4 mg and is preferred when IV access is difficult. IV options include lorazepam 4 mg IV which has longer duration of action diazepam 5-10 mg IV which has rapid onset but shorter duration or midazolam 5 mg IV. Intranasal midazolam 10 mg is another option. If the first dose fails a second dose can be given. If benzodiazepines fail second-line agents include fosphenytoin levetiracetam or valproate.
14,Neurology,Seizure Assessment,After midazolam 10 mg IM the seizure stops. The patient is now postictal with GCS of 9 eyes closed responds to pain with withdrawal and makes incomprehensible sounds. He is breathing at 10 breaths per minute with SpO2 92% on room air. A friend arrives and states the patient has epilepsy and takes levetiracetam but ran out of medication a week ago. What is the expected postictal state and how should you manage this patient?,Postictal confusion is expected and may last 30-60 minutes. Support airway provide oxygen monitor closely and transport. He does not need another seizure medication now,He should wake up immediately after the seizure stops and prolonged confusion indicates stroke,Give another dose of midazolam to keep him sedated,The postictal state indicates brain death,B,The postictal state follows seizure termination and includes confusion lethargy combativeness and focal deficits like Todd paralysis that can mimic stroke. It typically lasts 5-30 minutes but can persist longer. This patient's GCS of 9 with slow respirations is consistent with postictal state plus benzodiazepine effect. Management includes airway support with positioning and possible adjuncts supplemental oxygen monitoring for recurrent seizures and supportive care during transport. Do not give more benzodiazepines unless seizures recur as respiratory depression is additive. Document the friend's information about medication noncompliance.
15,Neurology,Seizure Assessment,A 28-year-old female with known epilepsy has a witnessed seizure that lasts approximately 90 seconds then stops spontaneously. She is now postictal and slowly becoming more alert. Her husband states this is her typical seizure pattern and she has about 2 per month despite taking lamotrigine. Vital signs are BP 138/88 HR 96 RR 16 SpO2 97% on room air. Blood glucose is 102 mg/dL. She is becoming more oriented and asking what happened. She wants to refuse transport. Is this appropriate?,No. All seizure patients must be transported for CT scan,A brief self-limited seizure in a known epileptic with return to baseline who has a responsible adult present may refuse transport with appropriate documentation and instructions to follow up with her neurologist,Yes she can refuse but she should not take her seizure medication today,She must be placed on psychiatric hold for her safety,B,Not every seizure requires emergency department evaluation. A patient with known epilepsy who has a typical self-limited seizure returns to neurological baseline has no injuries has stable vital signs has a responsible adult present and can make an informed decision may refuse transport. Detailed documentation should include seizure description duration recovery baseline mental status normal exam vital signs medical decision-making capacity explanation of risks of refusal recommended follow-up with neurologist and signatures. She should take her seizure medication as prescribed.
16,Neurology,Seizure Types,A 6-year-old male had a generalized tonic-clonic seizure lasting 3 minutes that has now stopped. His mother states he developed a fever of 103F today with a cold. He has never had a seizure before. He is now postictal but waking up and recognizes his mother. He has no history of epilepsy and takes no medications. Vital signs show temp 102.8F HR 118 RR 22 SpO2 98%. What type of seizure is most likely and what is the prognosis?,This is epilepsy and he will need lifelong seizure medication,This is most likely a simple febrile seizure which occurs in children 6 months to 5 years is associated with fever and has excellent prognosis. Most children do not develop epilepsy,This is meningitis until proven otherwise,Febrile seizures always indicate brain damage,B,Simple febrile seizures are common occurring in 2-5% of children between 6 months and 5 years of age. They are associated with fever typically from viral illness are generalized lasting less than 15 minutes and do not recur within 24 hours. Prognosis is excellent with no increased risk of developmental problems and only slightly increased risk of epilepsy about 2-4% versus 1% general population. Complex febrile seizures are focal prolonged greater than 15 minutes or recurrent and have higher risk of subsequent epilepsy. This child should be evaluated to identify the fever source but the seizure itself is typically benign.
17,Neurology,Seizure Types,You respond to a 45-year-old female who according to coworkers was staring blankly and not responding for about 2 minutes. She then began making lip-smacking movements and picking at her clothes. She did not fall or have convulsions. Now she appears confused and does not remember what happened. She has no seizure history. Vital signs are normal. Blood glucose is 94 mg/dL. What type of seizure did she most likely experience?,Grand mal seizure,Focal seizure with impaired awareness previously called complex partial seizure characterized by altered consciousness and automatisms without generalized convulsions,Absence seizure which only occurs in children,Pseudoseizure with psychiatric origin,B,Focal seizures with impaired awareness previously called complex partial seizures originate in one area of the brain and impair consciousness. They often involve automatisms which are repetitive purposeless movements like lip smacking chewing picking or fumbling. There is no generalized tonic-clonic activity. The patient typically has no memory of the event and may have a postictal period of confusion. These seizures commonly originate in the temporal lobe. New onset focal seizures in an adult require evaluation for underlying cause including brain tumor stroke infection or other structural lesion. She needs transport for evaluation including brain imaging.
18,Neurology,Seizure Complications,A 55-year-old male with alcohol use disorder is found seizing by family. He reportedly stopped drinking 3 days ago after a week-long binge. The seizure stops after 2 minutes but he remains confused and tremulous. He is diaphoretic and tachycardic. Vital signs are BP 168/104 HR 122 RR 22 SpO2 96% Temp 100.4F. He is oriented only to person and appears to be seeing things that are not there. What is the cause of his seizure and what is your primary concern?,He has epilepsy exacerbated by alcohol,He is experiencing alcohol withdrawal seizures. Primary concern is progression to delirium tremens which has significant mortality without treatment,He had a seizure from alcohol intoxication,This is a febrile seizure from his low-grade fever,B,Alcohol withdrawal seizures typically occur 6-48 hours after last drink in patients with alcohol dependence. They are usually generalized tonic-clonic and may be single or multiple. The constellation of autonomic hyperactivity tremor hypertension tachycardia diaphoresis fever confusion and hallucinations suggests progression toward delirium tremens DTs which has 5-15% mortality without treatment. Benzodiazepines are the treatment of choice as they address the underlying GABA receptor dysfunction. This patient needs IV benzodiazepines aggressive hydration thiamine to prevent Wernicke encephalopathy and close monitoring in an ICU setting.
