id,category,subcategory,question,option_a,option_b,option_c,option_d,correct_answer,rationale,certification,difficulty
37,Cardiology,Shock Cardiogenic,A 64-year-old female presents with crushing chest pain and severe dyspnea. She is pale diaphoretic and extremely anxious. She has a history of hypertension and diabetes. Vital signs are BP 72/48 HR 126 RR 32 SpO2 84% on room air. She has crackles in both lung fields and cool mottled extremities. The 12-lead shows ST elevation in V1-V6 I and aVL consistent with large anterolateral STEMI. She is alert but confused. What type of shock is this patient in and what are the treatment priorities?,Septic shock treat with fluids and antibiotics,Cardiogenic shock from massive MI. Treatment includes cautious fluids avoiding overload inotropic support emergent reperfusion and possibly mechanical support,Hypovolemic shock from GI bleeding give large fluid bolus,Anaphylactic shock give epinephrine,B,This patient has cardiogenic shock complicating a large anterior STEMI. Cardiogenic shock occurs when the heart cannot pump adequately to meet tissue demands typically when more than 40% of myocardium is damaged. Signs include hypotension tachycardia pulmonary congestion and end-organ hypoperfusion. Unlike hypovolemic shock large fluid boluses worsen pulmonary edema. Treatment includes cautious fluids vasopressors and inotropes like norepinephrine and dobutamine and emergent reperfusion via PCI which is the most important intervention. Mechanical support with IABP or Impella may be needed.,Paramedic,hard
38,Cardiology,Shock Cardiogenic,You are transporting the cardiogenic shock patient from the previous question. You have established IV access and given 250 mL fluid bolus with minimal improvement. BP remains 74/50. Medical control orders you to start a vasopressor infusion. What is the most appropriate vasopressor choice for cardiogenic shock?,Phenylephrine 100-200 mcg/min,Norepinephrine starting at 0.1-0.5 mcg/kg/min titrated to MAP above 65,Dopamine at 20 mcg/kg/min,Vasopressin 0.04 units/min,B,Current evidence supports norepinephrine as the first-line vasopressor for cardiogenic shock. The SOAP II trial showed dopamine was associated with more arrhythmias and mortality in cardiogenic shock subgroup. Norepinephrine provides both vasoconstriction and some inotropic effect. Starting dose is 0.1-0.5 mcg/kg/min titrated to MAP above 65 mmHg. Dobutamine can be added if additional inotropy is needed once adequate perfusion pressure is achieved. Phenylephrine is a pure vasoconstrictor and may worsen cardiac output by increasing afterload. The definitive treatment remains emergent reperfusion.,Paramedic,hard
39,Cardiology,Shock Hypovolemic,A 25-year-old male presents after a motorcycle crash. He was not wearing a helmet and has obvious head trauma. He also has a deformed left femur and abdominal bruising. He is confused and combative. Vital signs are BP 78/50 HR 138 RR 28 SpO2 94% on room air. His skin is pale cool and diaphoretic. Capillary refill is 5 seconds. What class of hemorrhagic shock is this patient in and what are the fluid resuscitation priorities?,Class I shock with 15% blood loss give 500 mL NS,Class III or IV shock with 30-40% or greater blood loss. Priorities are hemorrhage control permissive hypotension and blood products not crystalloid,Class II shock with 15-30% blood loss give 2L crystalloid,This is neurogenic shock from head trauma not hypovolemic,B,This patient has signs of severe hemorrhagic shock including marked hypotension severe tachycardia altered mental status and poor perfusion indicating Class III or IV hemorrhage with greater than 30% blood volume loss. Modern trauma resuscitation emphasizes damage control resuscitation with limited crystalloid to avoid dilutional coagulopathy permissive hypotension maintaining SBP 80-90 in penetrating trauma and early blood products in 1:1:1 ratio of PRBC plasma and platelets. Hemorrhage control takes priority. Large crystalloid volumes are associated with worse outcomes in hemorrhagic shock.,Paramedic,hard
40,Cardiology,Shock Distributive,A 45-year-old male presents with fever and confusion. His wife reports he has been sick for 3 days with cough and fever and today became very confused. He has no significant medical history. Vital signs are BP 72/38 HR 128 RR 26 SpO2 91% on room air Temp 103.4F. His skin is warm and flushed initially but his extremities are becoming mottled. Capillary refill is 4 seconds. What type of shock is this and what is the initial fluid resuscitation target?,Cardiogenic shock from myocarditis,Septic shock from pneumonia. Initial fluid resuscitation is 30 mL/kg crystalloid within the first hour,Anaphylactic shock give epinephrine,Neurogenic shock from fever affecting the brain,B,This patient has septic shock characterized by suspected infection with life-threatening organ dysfunction manifested by hypotension altered mental status and hypoperfusion. Early septic shock may have warm flushed skin from vasodilation but progresses to cold mottled skin as compensatory mechanisms fail. The Surviving Sepsis Campaign recommends 30 mL/kg crystalloid bolus within the first hour. If hypotension persists after adequate fluid resuscitation vasopressors norepinephrine first-line should be started. Early antibiotics within one hour and source control are critical. Lactate measurement helps guide resuscitation.,Paramedic,hard
41,Cardiology,Shock Distributive,A 32-year-old female with a known severe peanut allergy accidentally ate something containing peanuts at a restaurant. Within 5 minutes she developed hives lip swelling difficulty breathing and feels faint. She used her EpiPen before EMS arrival. On exam she has diffuse urticaria angioedema of face and lips inspiratory stridor and expiratory wheezing. Vital signs are BP 78/42 HR 142 RR 32 SpO2 86% on room air. Despite the EpiPen she remains in shock. What is the next medication intervention?,Diphenhydramine 50 mg IV as it works better than epinephrine,Repeat epinephrine 0.3-0.5 mg IM as the first dose was insufficient,Methylprednisolone 125 mg IV to reduce inflammation,Albuterol nebulizer for the wheezing,B,Anaphylactic shock causes distributive shock through massive histamine-mediated vasodilation and capillary leak. Epinephrine is the only life-saving medication and should be repeated every 5-15 minutes if symptoms persist. The IM dose is 0.3-0.5 mg of 1:1000 concentration. This patient remains in shock with airway compromise requiring repeat epinephrine. IV epinephrine infusion may be needed for refractory cases. Adjunct medications include H1 blockers diphenhydramine H2 blockers famotidine corticosteroids and bronchodilators but these should never delay epinephrine. Aggressive IV fluids are also needed for the hypotension.,Paramedic,hard
42,Cardiology,Shock Obstructive,A 62-year-old female post-operative day 5 from hip replacement surgery presents with sudden onset severe dyspnea and chest pain. She has been mostly bedbound since surgery. She is extremely anxious and dyspneic. Vital signs are BP 82/58 HR 132 RR 34 SpO2 82% on room air. Her neck veins are distended. Lung sounds are clear. The 12-lead shows sinus tachycardia with right axis deviation S1Q3T3 pattern and T wave inversions in V1-V4. What is the most likely diagnosis and what treatment should be considered?,Acute anterior STEMI needs emergent PCI,Massive pulmonary embolism causing obstructive shock. Consider thrombolytics if available,Tension pneumothorax needs needle decompression,Cardiac tamponade needs pericardiocentesis,B,This patient has classic risk factors and presentation for massive pulmonary embolism causing obstructive shock. Recent surgery and immobilization are major risk factors. The combination of hypoxia hypotension clear lungs elevated JVD and right heart strain on ECG is characteristic. In massive PE with shock thrombolytics may be life-saving despite bleeding risks. tPA 100 mg IV over 2 hours or accelerated regimens can be used. If thrombolytics are not available focus on supportive care with fluids cautious as RV is preload-sensitive vasopressors and oxygenation. Surgical embolectomy or catheter-based intervention are alternatives.,Paramedic,hard
43,Cardiology,Shock Obstructive,A 22-year-old male presents after being stabbed in the left chest. He is anxious and dyspneic. On exam he has a small stab wound at the left 5th intercostal space near the sternum. His neck veins are markedly distended. Heart sounds are muffled and distant. Breath sounds are equal bilaterally. Vital signs are BP 68/44 HR 138 RR 28 SpO2 96% on room air. Trachea is midline. What is causing this patient's shock and what is the definitive treatment?,Tension pneumothorax perform bilateral needle decompression,Cardiac tamponade from penetrating cardiac injury. Definitive treatment is surgical thoracotomy but pericardiocentesis may temporize,Massive hemothorax perform chest tube thoracostomy,Hypovolemic shock from blood loss give massive transfusion,B,This patient has penetrating cardiac injury with cardiac tamponade characterized by Beck triad of hypotension distended neck veins and muffled heart sounds. The wound location near the sternum at the 5th ICS is in the cardiac box. Unlike tension pneumothorax breath sounds are equal and trachea is midline. Tamponade causes obstructive shock as blood in the pericardium prevents ventricular filling. Definitive treatment is surgical thoracotomy with pericardiotomy and cardiac repair. Pericardiocentesis removing as little as 20-30 mL may temporarily improve hemodynamics but traumatic tamponade often involves clotted blood requiring surgery.,Paramedic,hard
44,Cardiology,Hypertension,A 58-year-old male presents with severe headache blurred vision and chest discomfort. He has a history of hypertension but admits to not taking his medications for several months. On exam he is alert but anxious and diaphoretic. He has papilledema on fundoscopic exam. Vital signs are BP 242/138 HR 98 RR 18 SpO2 98% on room air. The 12-lead shows LVH with strain pattern but no acute ST changes. What is this patient's condition and how should blood pressure be managed?,He has hypertensive urgency and can be managed with oral medications and outpatient follow-up,He has hypertensive emergency with end-organ damage manifested by encephalopathy and retinopathy. IV antihypertensives should reduce MAP by 20-25% in the first hour,He needs immediate BP reduction to normal with IV labetalol,This is not a true emergency and he should see his doctor tomorrow,B,Hypertensive emergency is defined as severely elevated BP with acute end-organ damage. This patient has hypertensive encephalopathy with headache visual changes and papilledema. Other end-organ damage includes ACS stroke aortic dissection and acute kidney injury. Management requires IV antihypertensives but excessive or rapid reduction can cause stroke or MI from hypoperfusion. Target is 20-25% reduction in MAP in the first hour then gradual reduction over 24-48 hours. Labetalol or nicardipine IV are commonly used. Hypertensive urgency is severe BP without end-organ damage and can be managed less urgently.,Paramedic,hard
45,Cardiology,Hypertension,A 72-year-old male presents with sudden onset of the worst headache of his life followed by vomiting and confusion. He has a history of hypertension. On exam he is somnolent with a stiff neck and right-sided weakness. Vital signs are BP 228/124 HR 68 RR 18 SpO2 97% on room air. What is the most likely diagnosis and what is the blood pressure target?,Hypertensive encephalopathy reduce BP by 25% in first hour,Likely hemorrhagic stroke from hypertension. Aggressively reduce SBP to less than 140 mmHg if intracerebral hemorrhage is confirmed,Ischemic stroke maintain permissive hypertension up to 220/120,Meningitis do not treat blood pressure,B,Thunderclap headache with focal neurological deficits and severe hypertension suggests hemorrhagic stroke likely intracerebral hemorrhage or subarachnoid hemorrhage. In intracerebral hemorrhage elevated BP promotes hematoma expansion and worsens outcomes. Current guidelines from AHA/ASA recommend SBP reduction to less than 140 mmHg for ICH patients presenting with SBP 150-220 mmHg. This is more aggressive than ischemic stroke or hypertensive encephalopathy targets. IV nicardipine or labetalol are preferred agents. CT scan is needed to confirm hemorrhage versus ischemia before determining final BP target.,Paramedic,hard
46,Cardiology,ACS Complications,A 68-year-old female is being transported 3 days after an anterior STEMI that was treated with PCI. She suddenly develops severe dyspnea and a new loud holosystolic murmur heard best at the left lower sternal border. Her vital signs deteriorate to BP 74/58 HR 128 RR 32 SpO2 84% on 15L NRB. What complication has likely occurred and what is the treatment?,Papillary muscle rupture causing acute mitral regurgitation,Ventricular septal rupture causing acute VSD with left-to-right shunt. Treatment is supportive with vasodilators and inotropes en route to emergent surgical repair,Acute stent thrombosis needs emergent re-catheterization,Free wall rupture and tamponade needs pericardiocentesis,B,Ventricular septal rupture is a mechanical complication of MI occurring typically 3-5 days post-MI when necrotic tissue is weakest. It causes acute left-to-right shunt with right heart volume overload and pulmonary overcirculation leading to cardiogenic shock. The new holosystolic murmur at left lower sternal border with thrill is characteristic. This is distinguished from papillary muscle rupture which causes mitral regurgitation with murmur at apex radiating to axilla. Treatment is emergent surgical repair. Medical management with vasodilators to reduce afterload and inotropes is temporizing. IABP may help. Mortality without surgery exceeds 90%.,Paramedic,hard
47,Cardiology,ACS Complications,A 71-year-old male who had an inferior STEMI 2 days ago suddenly loses consciousness. The cardiac monitor shows ventricular fibrillation. He is defibrillated successfully and converted to sinus rhythm. He is now awake and hemodynamically stable with BP 118/72. Laboratory results show potassium of 2.9 mEq/L and magnesium of 1.4 mg/dL. What is the likely etiology of his VF arrest and what treatment will help prevent recurrence?,His stent has thrombosed and he needs emergent re-catheterization,Post-MI VF triggered by hypokalemia and hypomagnesemia. Aggressive electrolyte replacement will reduce arrhythmia risk,This is expected post-MI and no specific treatment will help,He needs an ICD implanted immediately,B,Electrolyte abnormalities particularly hypokalemia and hypomagnesemia significantly increase arrhythmia risk in the post-MI setting. Both abnormalities affect cardiac repolarization and lower the threshold for ventricular arrhythmias. Aggressive IV replacement is indicated with potassium targeting level above 4.0 mEq/L and magnesium targeting above 2.0 mg/dL. Diuretics commonly used in heart failure can worsen these abnormalities and levels should be monitored closely. While some post-MI arrhythmias are unavoidable optimizing electrolytes is a modifiable risk factor.,Paramedic,hard
48,Cardiology,Syncope,A 78-year-old male presents after a syncopal episode while walking to his mailbox. He had no warning and woke up on the ground unsure of how long he was unconscious. He has a history of hypertension and takes lisinopril and hydrochlorothiazide. He denies chest pain or palpitations. Vital signs are BP 148/82 HR 64 RR 16 SpO2 98% on room air. The 12-lead ECG shows normal sinus rhythm with a QRS of 132 ms showing right bundle branch block pattern and left anterior fascicular block. This bifascicular block pattern in a patient with syncope suggests:,Vasovagal syncope which is benign,High risk for progressing to complete heart block causing cardiac syncope. He needs monitoring and likely pacemaker evaluation,Orthostatic hypotension from his medications,Seizure rather than syncope,B,Syncope in a patient with bifascicular block RBBB plus LAFB or LPFB is concerning for intermittent complete heart block causing Stokes-Adams attacks. The conduction system disease evident on ECG indicates one fascicle is functioning and if it fails transiently complete block occurs. These patients are at high risk for sudden death from prolonged asystole. Ambulatory monitoring or electrophysiology study can evaluate for infra-Hisian block. Many will require permanent pacemaker. This is not a benign cause of syncope and requires urgent cardiology evaluation.,Paramedic,hard
49,Cardiology,Device Emergency,A 66-year-old male with an implantable cardioverter-defibrillator ICD presents with multiple shocks from his device over the past hour. He estimates he has received 8-10 shocks. He is awake and anxious. The cardiac monitor shows sinus tachycardia at 115 bpm with occasional PVCs. Vital signs are BP 138/82 HR 115 RR 20 SpO2 97% on room air. His ICD continues to fire while you are assessing him during what appears to be sinus rhythm. What is the most likely problem and what is the intervention?,The ICD is appropriately treating VT and no intervention is needed,The ICD is delivering inappropriate shocks likely due to lead malfunction or oversensing. A magnet placed over the device will inhibit shock therapy,The patient is in VF and the shocks are appropriate,The ICD battery is depleted and needs replacement,B,Inappropriate ICD shocks can occur from lead fracture sensing artifacts electromagnetic interference oversensing of T waves or SVT being misinterpreted as VT. Multiple shocks for what appears to be sinus rhythm suggests inappropriate therapy. This causes significant patient distress and can be harmful. Placing a magnet over the ICD pulse generator will temporarily inhibit tachyarrhythmia detection and shock delivery. This does not affect pacing function. The magnet should remain in place during transport. The patient needs urgent device interrogation to identify and correct the problem.,Paramedic,hard
