aemt_id,category,subcategory,question,option_a,option_b,option_c,option_d,correct_answer,rationale
AEMT-CARD-019,AEMT Cardiology,Heart Failure,You are treating the heart failure patient with CPAP at 10 cmH2O. His SpO2 has improved from 90% to 94% and he says he can breathe easier. You have established IV access and given nitroglycerin 0.4 mg SL. His blood pressure was 162/94 and is now 138/86. He remains in moderate distress. Should you give additional nitroglycerin?,No because his blood pressure has already dropped 24 mmHg,Yes if his chest pain or dyspnea persists and SBP remains above 100 you can give additional nitroglycerin every 5 minutes to further reduce preload and improve his symptoms,Give morphine instead of more nitroglycerin,He needs diuretics not more nitroglycerin,B,Nitroglycerin reduces preload through venodilation which is beneficial in pulmonary edema. It can be given every 5 minutes as long as systolic BP remains above 100 mmHg and the patient continues to have symptoms. His blood pressure drop of 24 mmHg is expected and acceptable since he remains above 100 systolic. Continue nitroglycerin if dyspnea persists. Monitor blood pressure closely before each dose. CPAP should be continued as it provides ongoing benefit. Diuretics like furosemide are important in CHF management but are typically hospital treatments. The combination of positioning oxygen/CPAP and nitroglycerin is appropriate AEMT-level treatment for acute pulmonary edema.
AEMT-CARD-020,AEMT Cardiology,Heart Failure,A 74-year-old female with heart failure presents with severe respiratory distress. She is tripoding coughing up pink frothy sputum and can only speak one word at a time. She is pale and diaphoretic. Vital signs are BP 88/54 HR 128 RR 36 SpO2 78% on room air. She has crackles throughout both lung fields. Her skin is cool and clammy. How does her presentation differ from the previous patient and how does this change your management?,She has the same condition and should be treated identically,She has cardiogenic shock in addition to pulmonary edema evidenced by her hypotension and poor perfusion. Nitroglycerin and CPAP may worsen hypotension. Focus on oxygenation with BVM if needed positioning and rapid transport. Avoid preload reduction in hypotensive patients,Give aggressive nitroglycerin to reduce her fluid overload,Give her IV fluids to raise her blood pressure,B,This patient has cardiogenic pulmonary edema like the previous patient but she is also in cardiogenic shock with hypotension cool clammy skin and poor perfusion. Cardiogenic shock means the heart cannot pump adequately to meet tissue needs. In this situation preload-reducing treatments like nitroglycerin and CPAP may worsen hypotension by further reducing cardiac filling. CPAP also decreases venous return. Focus on oxygenation with high-flow oxygen or BVM assistance if needed positioning to optimize her work of breathing and rapid transport. She needs advanced interventions such as inotropes that are beyond AEMT scope. This is a critically ill patient.
AEMT-CARD-021,AEMT Cardiology,Hypertensive Emergency,A 52-year-old male presents with severe headache blurred vision and chest discomfort. He has a history of hypertension but admits he stopped taking his medications 3 months ago. He appears anxious and uncomfortable. Vital signs are BP 224/138 HR 102 RR 20 SpO2 97% on room air. He has no focal neurological deficits. What is this condition and what is appropriate AEMT management?,His blood pressure is only mildly elevated and does not need treatment,This is hypertensive emergency with symptoms suggesting end-organ damage headache visual changes chest discomfort. At AEMT level provide supportive care IV access cardiac monitoring and transport for BP management. If he has chest pain consistent with ACS consider nitroglycerin which may also help lower BP,Give him his home blood pressure medication,This is just anxiety and will resolve if he calms down,B,Hypertensive emergency is severely elevated blood pressure with evidence of acute end-organ damage. Target organs include the brain headache visual changes stroke heart chest pain MI and kidneys. This patient has symptoms suggesting brain and possibly cardiac involvement. At AEMT level treatment is primarily supportive with IV access monitoring and transport. If chest pain is consistent with ACS standard ACS treatment including nitroglycerin may be appropriate which would also help reduce blood pressure. Do not give oral home medications as their onset is unpredictable. Definitive treatment with IV antihypertensives is a hospital intervention. Monitor closely for deterioration especially stroke.
AEMT-CARD-022,AEMT Cardiology,Syncope,A 78-year-old female is found on the floor of her bathroom by her husband. He heard a thud and found her lying next to the toilet. She is now awake and says she felt lightheaded while urinating and the next thing she remembers is being on the floor. She denies chest pain or palpitations. She has a history of hypertension and takes metoprolol and lisinopril. Vital signs lying down are BP 132/78 HR 68 RR 16 SpO2 98%. What type of syncope is most likely and what additional assessment is important?,This is definitely a cardiac arrhythmia and she needs a pacemaker,This is most likely vasovagal or situational syncope triggered by the vagal response to urination. Obtain orthostatic vital signs by checking BP and HR lying then sitting then standing. Assess for injuries from the fall,She had a stroke,Her medications caused the syncope,B,Vasovagal syncope is the most common cause of syncope and can be triggered by situations like urination called micturition syncope straining or emotional stress. The vagal response causes bradycardia and vasodilation leading to transient cerebral hypoperfusion and loss of consciousness. Orthostatic vital signs are important to check for orthostatic hypotension which could contribute. Check BP and HR lying sitting and standing with a drop of 20 mmHg systolic or 10 mmHg diastolic being significant. Also assess for injuries from the fall as elderly patients are prone to fractures. Although this sounds like vasovagal syncope cardiac causes must be ruled out in elderly patients so transport for evaluation is appropriate.
AEMT-CARD-023,AEMT Cardiology,Syncope,You have obtained orthostatic vital signs on the syncope patient. Lying BP is 132/78 HR 68. Sitting BP is 126/76 HR 72. Standing BP is 88/54 HR 120 and she feels lightheaded and needs to sit down. What do these findings indicate?,Her vital signs are normal and she can refuse transport,She has significant orthostatic hypotension with a greater than 20 mmHg drop in systolic BP on standing. This combined with her age and medications metoprolol lisinopril suggests she needs evaluation for causes of orthostatic hypotension and is at high risk for recurrent syncope and falls,The standing heart rate increase shows she is just anxious,Only the lying blood pressure matters,B,Orthostatic hypotension is defined as a drop of 20 mmHg or more in systolic BP or 10 mmHg in diastolic BP within 3 minutes of standing. This patient has a 44 mmHg drop in systolic BP which is significant. Her heart rate appropriately increases trying to compensate but is inadequate to maintain blood pressure. Contributing factors likely include her medications as both beta-blockers and ACE inhibitors can contribute to orthostatic hypotension and possibly dehydration. She is at high risk for recurrent syncope and falls. Transport for evaluation and potentially medication adjustment. She should not be left alone and certainly should not drive.
AEMT-CARD-024,AEMT Cardiology,Syncope,A 68-year-old male had witnessed syncope while walking. Bystanders report he suddenly collapsed without warning and was unconscious for about 30 seconds. They report he appeared pale and may have had brief twitching movements. He has no history of seizures. He is now alert and oriented but tired. He denies any warning symptoms before passing out. Vital signs are normal and he is in normal sinus rhythm on the monitor. What feature of his syncope is concerning and why should he be transported?,Since his vital signs are normal and he feels fine he can refuse transport,Syncope without warning or prodrome especially during exertion or while upright and walking suggests cardiac syncope possibly from arrhythmia or structural heart disease. Cardiac syncope carries risk of sudden death. He needs cardiac evaluation,The brief twitching confirms this was a seizure not syncope,He had vasovagal syncope and will be fine,B,Cardiac syncope is suggested by several features including lack of prodrome or warning syncope during exertion or while upright syncope in older patients or those with heart disease and brief clonic movements which can occur with any cerebral hypoperfusion and do not indicate seizure. Vasovagal syncope typically has prodromal symptoms like nausea warmth tunnel vision. This patient had sudden collapse without warning while walking which raises concern for arrhythmia such as ventricular tachycardia or heart block or structural heart disease. Cardiac syncope carries significant risk of sudden death. He needs cardiac evaluation including ECG monitoring and possibly echocardiogram.
AEMT-CARD-025,AEMT Cardiology,Peripheral Vascular,A 62-year-old male presents with sudden onset of severe pain in his right leg that began 2 hours ago. His right leg is pale and cool compared to the left. He cannot feel you touching his right foot and cannot move his toes. You cannot palpate a dorsalis pedis or posterior tibial pulse on the right. The left leg has normal pulses and sensation. He has a history of atrial fibrillation and heart failure. His medications include warfarin diltiazem and furosemide. What is the likely diagnosis and why is his atrial fibrillation relevant?,He has a muscle cramp from dehydration,This is acute arterial occlusion likely from an embolus originating from his fibrillating left atrium. The 6 Ps of acute limb ischemia are present Pain Pallor Pulselessness Paresthesias Paralysis and Poikilothermia. This is a surgical emergency requiring rapid transport,He has deep vein thrombosis,His leg fell asleep from sitting too long,B,Acute arterial occlusion is a limb-threatening emergency. The classic 6 Ps are Pain Pallor Pulselessness Paresthesias abnormal sensation Paralysis and Poikilothermia cool temperature. This patient has all six. Atrial fibrillation causes blood stasis in the left atrium promoting thrombus formation. These thrombi can embolize to any arterial bed with the legs being a common site. Acute limb ischemia can lead to irreversible muscle and nerve damage within 6 hours. This patient needs emergent surgical intervention either embolectomy or catheter-based intervention. At AEMT level protect the limb keep it in dependent position avoid pressure or trauma and transport immediately.
AEMT-CARD-026,AEMT Cardiology,Peripheral Vascular,A 55-year-old female presents with left leg pain and swelling that has been worsening over the past 3 days. She recently returned from a long international flight. Her left calf is visibly swollen red and warm compared to the right. She has pain when you press on the calf. She denies chest pain or shortness of breath. Vital signs are normal. What condition do you suspect and what serious complication must you warn her about?,She has a muscle strain from the long flight,This is likely deep vein thrombosis DVT. The serious complication is pulmonary embolism if the clot dislodges and travels to the lungs. Do not massage the leg and advise her that any sudden shortness of breath or chest pain requires immediate emergency care,She has an infection requiring antibiotics,Apply ice and elevate the leg,B,Deep vein thrombosis DVT occurs when blood clots form in the deep veins usually of the legs. Risk factors include recent prolonged immobility such as long flights surgery malignancy and clotting disorders. Signs include unilateral leg swelling warmth redness and pain. The greatest danger is pulmonary embolism if the clot dislodges and travels through the venous system to the pulmonary arteries. Do not massage the affected leg as this could dislodge the clot. Counsel the patient that any sudden shortness of breath chest pain or lightheadedness requires immediate emergency evaluation for PE. Transport for evaluation including ultrasound to confirm DVT and anticoagulation treatment.
AEMT-CARD-027,AEMT Cardiology,Shock Recognition,A 45-year-old male was involved in a motorcycle crash with significant road rash and a deformed left femur. He is alert but anxious and restless. His skin is pale cool and diaphoretic. Vital signs are BP 92/68 HR 128 RR 24 SpO2 96% on room air. Capillary refill is 4 seconds. He is complaining of thirst. What type of shock is this patient experiencing and what stage?,He is in compensated hypovolemic shock. The tachycardia pallor diaphoresis and restlessness are compensatory mechanisms trying to maintain blood pressure. His BP is low-normal indicating early decompensation,He is in cardiogenic shock from a heart attack,He is in neurogenic shock from spinal injury,His vital signs are normal and he is not in shock,A,This patient is in hypovolemic shock from blood loss likely from his femur fracture and possibly internal injuries. Signs of compensated shock include tachycardia as the heart tries to maintain cardiac output peripheral vasoconstriction causing cool pale skin and delayed capillary refill diaphoresis from sympathetic activation and altered mental status such as anxiety and restlessness. Thirst is a primitive response to volume loss. His blood pressure is being maintained in the low-normal range by these compensatory mechanisms. Without treatment he will progress to decompensated shock with falling blood pressure. Management includes controlling obvious hemorrhage IV access fluid resuscitation per trauma protocols and rapid transport.
AEMT-CARD-028,AEMT Cardiology,Shock Recognition,You continue treating the trauma patient. En route to the hospital his level of consciousness decreases and he becomes confused and lethargic. His blood pressure has dropped to 72/50 and his heart rate has increased to 142. His skin is now mottled and cool throughout. Capillary refill is greater than 5 seconds. What has happened and what is his prognosis without intervention?,He is just tired from the accident,He has progressed from compensated to decompensated hypovolemic shock. His compensatory mechanisms have failed and blood pressure has dropped. Without aggressive treatment including hemorrhage control fluids and likely blood transfusion and surgery he will die,His blood pressure is improving,Give him nitroglycerin to help his perfusion,B,Decompensated shock occurs when the body's compensatory mechanisms fail and can no longer maintain adequate blood pressure and tissue perfusion. Signs include falling blood pressure worsening mental status from lethargy to unresponsiveness mottled or cyanotic skin and prolonged capillary refill. This represents massive volume loss likely greater than 30-40% of blood volume. Without aggressive intervention including hemorrhage control IV fluids blood transfusion and surgical repair of bleeding sources the patient will progress to irreversible shock and death. Continue IV fluid boluses transport immediately and notify the receiving facility of a critical trauma patient.
AEMT-CARD-029,AEMT Cardiology,Shock Recognition,A 58-year-old male presents with severe weakness. He has a history of a GI bleed last year. He states he has had black tarry stools for the past 2 days and vomited blood this morning. He is lethargic and confused. His skin is pale and cool. Vital signs are BP 78/52 HR 136 RR 26 SpO2 95% on room air. What type of shock is this and what should you suspect as the cause?,This is septic shock from an infection,This is hypovolemic shock from GI hemorrhage. The black tarry stools melena indicate upper GI bleeding and the hematemesis confirms active bleeding. This is life-threatening hemorrhage requiring aggressive fluid resuscitation and rapid transport,He is dehydrated from not drinking enough,His blood pressure is only slightly low,B,This patient has hemorrhagic shock from gastrointestinal bleeding. Melena black tarry stools indicates upper GI bleeding where blood is digested as it passes through the intestines. Hematemesis vomiting blood confirms significant upper GI hemorrhage. Common causes include peptic ulcer disease esophageal varices and gastritis. His vital signs indicate severe shock. At AEMT level establish two large-bore IVs give crystalloid fluid boluses and transport rapidly. This patient will likely need blood transfusion and possibly endoscopy or surgery to control bleeding. Position supine with legs elevated if tolerated. Monitor closely for deterioration.
AEMT-CARD-030,AEMT Cardiology,Shock Recognition,A 72-year-old female presents with fever and confusion. Her family states she has had a cough and urinary symptoms for several days. She is warm to touch with flushed skin. Vital signs are BP 86/52 HR 118 RR 24 SpO2 94% Temp 102.8F. Her extremities are warm and well-perfused initially but you notice her mental status is deteriorating and her skin is becoming mottled. What type of shock is this and what is the initial treatment?,This is hypovolemic shock and she needs IV fluids only,This is septic shock from infection likely UTI progressing to sepsis. Initial treatment includes IV access aggressive crystalloid fluid bolus 30 mL/kg and rapid transport. Early fluids improve outcomes in sepsis,She just has the flu and needs rest,Her fever is causing the low blood pressure and it will improve with cooling,B,Septic shock is distributive shock caused by systemic infection leading to widespread vasodilation cytokine release and capillary leak. Early warm septic shock may have warm flushed skin from vasodilation but as shock progresses skin becomes mottled and cool. This patient has identified infection sources UTI and pneumonia with systemic inflammatory response fever tachycardia tachypnea and organ dysfunction hypotension altered mental status meeting criteria for septic shock. Initial treatment per Surviving Sepsis Campaign guidelines is aggressive IV fluid resuscitation with 30 mL/kg crystalloid bolus within the first hour. Early fluids improve outcomes. Transport for antibiotics and possible vasopressors.
AEMT-CARD-031,AEMT Cardiology,Aortic Emergencies,A 64-year-old male presents with sudden onset of severe tearing chest pain that radiates to his back between his shoulder blades. The pain began 1 hour ago and he rates it 10 out of 10. He has a history of long-standing poorly controlled hypertension. Vital signs are BP 188/108 in the right arm and 142/88 in the left arm. HR is 102 RR 22 SpO2 96%. What critical diagnosis must you consider and what finding supports it?,This is a heart attack and should be treated with aspirin and nitroglycerin,The tearing pain radiating to the back and significant blood pressure differential greater than 20 mmHg between arms suggest aortic dissection. This is a life-threatening emergency. Do NOT give aspirin or anticoagulants. Gentle transport and pain control with rapid transport to a facility capable of definitive management,He has a muscle strain from exercise,The blood pressure difference is a measurement error,B,Aortic dissection occurs when a tear in the aortic intima allows blood to dissect between the layers of the aortic wall. Classic presentation includes sudden severe tearing or ripping pain often radiating to the back. Blood pressure differential greater than 20 mmHg between arms suggests the dissection involves the subclavian artery origin. This is a surgical emergency with high mortality. Do NOT give aspirin thrombolytics or anticoagulants as these could be fatal. Treatment focuses on heart rate and blood pressure control to reduce shear forces on the aorta. Transport gently and rapidly to a facility with cardiothoracic surgery capability.
AEMT-CARD-032,AEMT Cardiology,Aortic Emergencies,You suspect aortic dissection in the patient with tearing chest pain and blood pressure differential. His pain is severe. He is requesting pain medication. Your protocols include fentanyl for pain management. Is it appropriate to give pain medication and why might it be beneficial beyond comfort?,Pain medication is never appropriate for chest pain,Yes pain medication is appropriate and beneficial. Severe pain causes catecholamine release which increases heart rate and blood pressure both of which worsen aortic dissection by increasing shear forces on the damaged aorta. Pain control helps limit these forces,Give aspirin instead of narcotics for chest pain,Wait until the hospital to give any medication,B,Pain management in aortic dissection is not just for patient comfort but is therapeutically important. Severe pain triggers catecholamine release causing tachycardia and hypertension. In aortic dissection elevated heart rate and blood pressure increase shear forces on the aortic wall potentially extending the dissection. Pain control with IV opioids like fentanyl helps reduce these sympathetic responses. The goal is to maintain heart rate below 60 bpm and systolic BP between 100-120 mmHg which typically requires IV beta-blockers at the hospital. At AEMT level providing pain relief with available analgesics helps achieve some of this benefit while transporting.
AEMT-CARD-033,AEMT Cardiology,Cardiac Medications,A 56-year-old male is having chest pain consistent with ACS. You have given aspirin 324 mg and are preparing to give nitroglycerin. Before giving nitroglycerin what questions should you ask and what vital sign must you check?,No questions are needed before giving nitroglycerin,Ask about use of erectile dysfunction medications in the past 24-48 hours right ventricular infarction symptoms and check that systolic BP is above 100 mmHg. Also ask about sensitivity to nitrates and use of other medications,Just check if he has taken nitroglycerin before,Only check blood pressure after giving nitroglycerin,B,Before nitroglycerin administration verify: 1 Systolic BP is above 100 mmHg as NTG causes vasodilation and can drop BP further 2 No use of phosphodiesterase-5 inhibitors sildenafil vardenafil tadalafil within 24-48 hours as the combination can cause profound hypotension 3 No signs of right ventricular infarction inferior MI with hypotension JVD clear lungs as RV infarction is preload-dependent 4 No known sensitivity to nitrates. Also consider recent use of other vasodilating medications. These contraindications can be life-threatening if ignored.
AEMT-CARD-034,AEMT Cardiology,Cardiac Medications,You are treating a 62-year-old female with SVT. Your protocols allow you to assist the patient with vagal maneuvers. Describe the modified Valsalva maneuver and explain why it works.,Have her drink cold water quickly,Have her blow into a syringe or bear down as if having a bowel movement for 15 seconds while semi-recumbent then immediately lay her flat and elevate her legs for 15 seconds. This increases vagal tone slowing AV node conduction and can terminate SVT,Have her cough forcefully,Apply ice to her face only,B,The modified Valsalva maneuver combines straining to increase intrathoracic pressure with postural change to enhance venous return. Have the patient blow into a 10mL syringe or bear down forcefully for 15 seconds while semi-recumbent at 45 degrees. Immediately lay them flat and elevate their legs for 15 seconds. This sequence increases vagal tone more effectively than traditional Valsalva alone. The vagal response slows conduction through the AV node which can interrupt the reentry circuit that causes most SVT. Success rate is approximately 40-50% for modified versus 17-20% for standard Valsalva. This can be attempted multiple times if unsuccessful.
AEMT-CARD-035,AEMT Cardiology,Cardiac Medications,A 70-year-old male with a history of angina is having chest pain. He tells you he took 5 of his nitroglycerin tablets before calling 911. His blood pressure is now 82/54 and he feels dizzy and nauseous. His chest pain has improved to 2 out of 10. What has happened and how should you manage this?,Give him more nitroglycerin since it is working,He has excessive hypotension from nitroglycerin overdose. Lay him supine elevate his legs and give an IV fluid bolus to increase preload and blood pressure. Do NOT give any additional nitroglycerin,His blood pressure is normal,Give aspirin to counteract the nitroglycerin,B,This patient has taken excessive nitroglycerin 5 tablets resulting in significant hypotension from vasodilation. Normal nitroglycerin dosing is up to 3 tablets at 5-minute intervals yet he took 5 likely rapidly. Management of nitroglycerin-induced hypotension includes positioning supine with legs elevated to increase venous return and IV crystalloid bolus to expand intravascular volume and increase preload. The effect of sublingual nitroglycerin is relatively short typically 20-30 minutes so his blood pressure should improve with supportive care. Do not give additional nitroglycerin. Monitor closely and be prepared for complications if his blood pressure does not improve.
