id,category,subcategory,question,option_a,option_b,option_c,option_d,correct_answer,rationale,certification,difficulty
18,Cardiology,Arrhythmia VT,A 58-year-old female with no known cardiac history presents after a syncopal episode at home. She is now awake but states she feels her heart racing. She takes no medications regularly but admits to drinking 5-6 cups of coffee and taking multiple over-the-counter diet pills today. She appears anxious and mildly diaphoretic. Vital signs are BP 86/54 HR 220 regular RR 24 SpO2 94% on room air. The cardiac monitor shows a wide complex tachycardia at 220 bpm that is regular but the QRS morphology appears to vary slightly in axis from beat to beat with a sinusoidal appearance. What is the most likely rhythm and what is the treatment?,Monomorphic VT treat with amiodarone,Polymorphic VT degenerating toward torsades de pointes. This patient is unstable and needs immediate defibrillation,SVT with aberrancy treat with adenosine,Atrial flutter with aberrant conduction,B,The wide complex tachycardia with varying QRS axis and sinusoidal appearance suggests polymorphic VT which can degenerate to ventricular fibrillation. The stimulant use coffee and diet pills may have triggered this through catecholamine excess or QT prolongation from the diet pills. Unlike stable monomorphic VT polymorphic VT is immediately life-threatening and in an unstable patient requires immediate defibrillation not synchronized cardioversion because the varying QRS morphology makes synchronization unreliable. After defibrillation identify and treat underlying cause including electrolyte abnormalities and QT-prolonging substances.,Paramedic,hard
19,Cardiology,Arrhythmia VT,A 45-year-old female presents with palpitations and dizziness. She has a history of long QT syndrome and takes nadolol for this condition. She admits she ran out of her medication a week ago. She is awake but lightheaded. Vital signs are BP 94/62 HR 200 RR 20 SpO2 96% on room air. The cardiac monitor shows a wide complex tachycardia at approximately 200 bpm with a twisting axis that appears to rotate around the isoelectric line. The QRS complexes appear to point up then gradually rotate to point down then back up again. What is this rhythm and what is the specific treatment?,Monomorphic VT treat with amiodarone 300 mg IV,Torsades de pointes treat with magnesium sulfate 2 grams IV and consider overdrive pacing,Atrial fibrillation with WPW treat with procainamide,Ventricular fibrillation treat with defibrillation,B,Torsades de pointes meaning twisting of the points is a specific form of polymorphic VT that occurs in the setting of prolonged QT interval. The characteristic ECG pattern shows QRS complexes that appear to rotate around the baseline changing from upright to inverted in a sinusoidal pattern. Treatment differs from standard VT because standard antiarrhythmics like amiodarone can further prolong QT and worsen torsades. Magnesium sulfate 2 grams IV is first-line even with normal magnesium levels. If unstable defibrillate. Overdrive pacing at rates of 100-120 shortens QT and can prevent recurrence.,Paramedic,hard
20,Cardiology,Arrhythmia Bradycardia,A 78-year-old male presents with weakness dizziness and near-syncope that has been worsening over the past day. He has a history of coronary artery disease and takes metoprolol aspirin and atorvastatin. He appears pale and lethargic. Vital signs are BP 84/52 HR 36 regular RR 16 SpO2 94% on room air. The cardiac monitor shows a regular bradycardia at 36 bpm. The 12-lead ECG shows sinus rhythm with P waves present but the PR interval is constant at 0.24 seconds and every QRS complex is preceded by a P wave. No P waves are non-conducted. What type of heart block is present and what is the initial treatment?,First degree AV block which does not require treatment,This appears to be marked sinus bradycardia with first degree AV block. Initial treatment is atropine 0.5 mg IV,Third degree AV block requiring transcutaneous pacing,Second degree Type II requiring transcutaneous pacing,B,This patient has sinus bradycardia at 36 bpm with first degree AV block characterized by a prolonged but constant PR interval with all P waves conducting to QRS complexes. First degree block alone does not cause hemodynamic compromise but the extremely slow sinus rate is causing his symptoms. Initial treatment for symptomatic bradycardia is atropine 0.5 mg IV every 3-5 minutes to maximum 3 mg. If atropine fails to increase rate or improve symptoms transcutaneous pacing is indicated. Beta-blocker toxicity should be considered given his medication history and may be contributing to the severe bradycardia.,Paramedic,hard
21,Cardiology,Arrhythmia Bradycardia,A 82-year-old female presents with syncope. Her family states she suddenly became pale and collapsed but regained consciousness after about 20 seconds. She has a history of hypertension and takes amlodipine only. She is now awake and denies chest pain or dyspnea but feels weak. Vital signs are BP 108/68 HR 38 RR 16 SpO2 97% on room air. The cardiac monitor shows a slow regular rhythm at 38 bpm. The 12-lead ECG shows P waves at a rate of 80 that are completely independent of QRS complexes at 38. The QRS complexes are narrow at 0.08 seconds. What is the rhythm and is atropine likely to be effective?,Sinus bradycardia atropine will be effective,Third degree complete heart block with junctional escape. Atropine may provide temporary improvement but pacing is likely needed,Second degree Type I atropine will be effective,Sinus arrest with junctional escape,B,Complete or third degree heart block is characterized by complete AV dissociation where P waves and QRS complexes are completely independent with atrial rate faster than ventricular rate. The narrow QRS suggests a junctional escape rhythm arising from above the bundle branches. Atropine may provide temporary benefit by increasing the rate of the escape pacemaker but is often ineffective especially if block is infranodal. Transcutaneous pacing should be prepared immediately and may be needed. This patient will ultimately require permanent pacemaker placement.,Paramedic,hard
22,Cardiology,Arrhythmia Bradycardia,A 65-year-old male with a history of anterior MI two weeks ago presents with dizziness and one syncopal episode. He was discharged from the hospital 5 days ago on aspirin clopidogrel metoprolol lisinopril and atorvastatin. Vital signs are BP 92/58 HR 32 RR 18 SpO2 95% on room air. The cardiac monitor shows a very slow rhythm at 32 bpm. The 12-lead ECG shows P waves at 78 bpm with no consistent relationship to QRS complexes which occur at 32 bpm with wide QRS duration of 0.16 seconds. Atropine 0.5 mg IV is given with no improvement. What is the significance of the wide QRS and what is your next intervention?,The wide QRS indicates bundle branch block but has no prognostic significance. Give more atropine,The wide QRS indicates ventricular escape rhythm from infranodal block which typically does not respond to atropine. Immediate transcutaneous pacing is indicated,The wide QRS indicates hyperkalemia. Give calcium chloride,This is accelerated idioventricular rhythm which is benign post-MI,B,Complete heart block with wide QRS complex indicates the escape rhythm is arising from below the AV junction in the ventricles suggesting infranodal block. This is particularly common after anterior MI because the LAD supplies the bundle branches. Infranodal block has a worse prognosis than block at the AV node level and ventricular escape rhythms are slower and less reliable. Atropine is typically ineffective because it acts on the AV node not the ventricular escape focus. Immediate transcutaneous pacing is indicated. This patient will likely require permanent pacemaker.,Paramedic,hard
23,Cardiology,Arrhythmia Bradycardia,A 56-year-old female presents with weakness and dizziness over the past several hours. She has a history of depression and her family found her with empty pill bottles nearby. On exam she is lethargic and confused. Vital signs are BP 78/44 HR 44 wide complex RR 14 SpO2 95% on room air. Blood glucose is 98 mg/dL. The cardiac monitor shows a wide complex bradycardia at 44 bpm. The 12-lead shows QRS duration of 160 ms with a rightward axis. There is a long QTc interval. Given the suspected tricyclic antidepressant overdose what intervention may improve cardiac conduction and blood pressure?,Atropine 1 mg IV for the bradycardia,Sodium bicarbonate 1-2 mEq/kg IV to narrow the QRS and improve conduction,Glucagon 5 mg IV for the hypotension,Calcium chloride 1 gram IV,B,Tricyclic antidepressants cause cardiotoxicity through sodium channel blockade which manifests as QRS widening and can progress to ventricular arrhythmias. The right axis deviation and terminal R wave in aVR are characteristic of TCA toxicity. Sodium bicarbonate is the treatment of choice because it provides sodium to overcome channel blockade and alkalinization reduces drug binding to sodium channels. The goal is to narrow QRS to less than 100 ms and maintain pH 7.50-7.55. Atropine may help with anticholinergic effects but does not address sodium channel blockade. Glucagon is for beta-blocker overdose.,Paramedic,hard
24,Cardiology,Arrhythmia Pacing,You are treating a 74-year-old male with symptomatic third degree heart block and hypotension. Atropine was ineffective and you have initiated transcutaneous pacing. The pacemaker is set at 70 ppm and you are increasing the milliamps. At 60 mA you see pacer spikes on the monitor but no QRS complexes following them. At 80 mA you see pacer spikes followed by wide QRS complexes. How do you confirm mechanical capture and what should you set the final milliamp output?,Electrical capture is confirmed by QRS following each spike. Set output at 80 mA,Mechanical capture is confirmed by a pulse with each paced beat. Set output at approximately 90 mA which is 10% above threshold,Capture is confirmed by patient comfort. Set output at the lowest tolerable level,Capture is confirmed by blood pressure improvement alone,B,Electrical capture occurs when each pacer spike produces a QRS complex but this does not guarantee effective mechanical contraction of the heart. Mechanical capture must be confirmed by assessing for a pulse with each paced beat either by palpation or arterial waveform. Once capture threshold is determined at 80 mA in this case set output 10% above threshold typically adding 5-10 mA to ensure consistent capture. The patient will need sedation for comfort as transcutaneous pacing is painful. Prepare for transvenous pacing if transport is prolonged.,Paramedic,hard
25,Cardiology,Cardiac Arrest VF,You respond to a 59-year-old male who collapsed at a gym. Bystanders report he was on the treadmill when he suddenly grabbed his chest and fell. A bystander immediately started CPR and an AED was applied which delivered one shock before your arrival approximately 6 minutes after collapse. Upon your arrival CPR is ongoing and the patient is unresponsive with no pulse. The cardiac monitor shows coarse ventricular fibrillation. What is the correct sequence of interventions for this patient in VF arrest?,Intubate first then establish IV then shock then CPR,Continue CPR while charging defibrillator then clear and shock at maximum joules then immediately resume CPR for 2 minutes before rhythm check,Check pulse for 30 seconds then shock if still in VF then start CPR,Administer epinephrine first then shock then CPR,B,High-quality CPR and early defibrillation are the priorities in VF arrest. Upon confirming VF continue CPR while charging the defibrillator. Deliver shock at maximum joules for biphasic defibrillator typically 200J then immediately resume CPR for 2 minutes without rhythm or pulse check. Interruptions in CPR should be minimized. After 2 minutes check rhythm. If VF continues shock again and give epinephrine 1 mg IV. Continue cycles of 2 minutes CPR rhythm check shock with epinephrine every 3-5 minutes and amiodarone after second shock.,Paramedic,hard
26,Cardiology,Cardiac Arrest VF,Continuing with the gym arrest patient after your first shock the rhythm remains VF. You resume CPR and your partner establishes IV access. After the second shock VF persists. Per ACLS protocol what medications should be administered at this point?,Amiodarone 300 mg only,Epinephrine 1 mg IV and amiodarone 300 mg IV,Atropine 1 mg IV and lidocaine 100 mg IV,Vasopressin 40 units IV and magnesium 2 grams IV,B,After the second shock for persistent VF epinephrine 1 mg IV should be given to maximize coronary and cerebral perfusion during CPR. Epinephrine is repeated every 3-5 minutes. Amiodarone 300 mg IV push is the first-line antiarrhythmic for refractory VF given after the second shock with a second dose of 150 mg if needed. Lidocaine is an alternative if amiodarone unavailable. Atropine is no longer recommended for cardiac arrest. Vasopressin was removed from ACLS algorithm. Continue CPR for 2 minutes after medications before next rhythm check.,Paramedic,hard
27,Cardiology,Cardiac Arrest VF,After 15 minutes of resuscitation the gym arrest patient remains in refractory VF despite 5 shocks epinephrine 1 mg x 4 doses and amiodarone 300 mg plus 150 mg. CPR quality has been excellent with end-tidal CO2 consistently above 20 mmHg. What additional interventions might be considered for refractory VF and what does the EtCO2 tell you?,Terminate resuscitation as VF is not survivable after 15 minutes,Consider double sequential defibrillation changing pad position lidocaine esmolol. The EtCO2 above 20 indicates adequate CPR quality and continued viability,Give sodium bicarbonate 100 mEq for presumed acidosis,Switch to asystole protocol since VF is refractory,B,Refractory VF may respond to alternative strategies. Double sequential defibrillation using two defibrillators delivers shocks in rapid succession and may terminate VF when standard shocks fail. Changing defibrillator pad position to AP may improve vector. Lidocaine 1-1.5 mg/kg can be tried if amiodarone failed. Esmolol for sympathetic storm is emerging evidence. EtCO2 above 20 mmHg indicates adequate cardiac output during CPR and suggests the patient remains potentially viable. EtCO2 below 10 mmHg during quality CPR suggests poor prognosis.,Paramedic,hard
28,Cardiology,Cardiac Arrest PEA,You respond to a 67-year-old female who collapsed at home. Her husband reports she had been complaining of severe abdominal pain and vomited blood this morning before collapsing. She is unresponsive and pulseless. CPR is initiated. The cardiac monitor shows an organized rhythm with narrow QRS complexes at a rate of 72 bpm but there is no pulse. What is this rhythm and what is the most likely underlying cause?,Ventricular fibrillation from cardiac cause,PEA likely from hypovolemia due to massive GI hemorrhage,Asystole,Sinus rhythm with pulse that you cannot palpate,B,Pulseless electrical activity PEA is an organized cardiac rhythm without detectable pulse. The narrow complex organized rhythm at a reasonable rate suggests the heart is trying to function but is unable to generate effective output. Given the history of hematemesis and abdominal pain massive hypovolemia from GI hemorrhage is the most likely cause. PEA treatment focuses on identifying and treating reversible causes using the Hs and Ts mnemonic. For hypovolemia aggressive IV fluid resuscitation and transport for blood transfusion and surgical intervention are needed along with high-quality CPR and epinephrine every 3-5 minutes.,Paramedic,hard
29,Cardiology,Cardiac Arrest PEA,You are resuscitating a 55-year-old male found in cardiac arrest at home. His wife states he has kidney disease and missed dialysis twice this week. CPR is in progress. The cardiac monitor shows a wide complex bradycardic rhythm at 28 bpm without pulse. The QRS complexes are very wide at 200 ms and have a sine wave appearance. P waves are absent. What electrolyte abnormality is most likely and what is the immediate treatment?,Hyponatremia give normal saline bolus,Severe hyperkalemia give calcium chloride 1 gram IV immediately,Hypocalcemia give calcium gluconate,Hypomagnesemia give magnesium sulfate,B,The wide complex bradycardia with sine wave pattern and absent P waves in a dialysis patient is classic for severe hyperkalemia. Elevated potassium causes progressive ECG changes starting with peaked T waves then PR prolongation then P wave loss then QRS widening and finally sine wave pattern preceding VF and asystole. Calcium chloride 1 gram IV or calcium gluconate 3 grams IV should be given immediately to stabilize the cardiac membrane. This does not lower potassium but protects against lethal arrhythmias. Follow with sodium bicarbonate insulin with glucose and albuterol to shift potassium intracellularly.,Paramedic,hard
30,Cardiology,Cardiac Arrest PEA,A 42-year-old male is found in cardiac arrest at a construction site after a coworker reports he was struck in the chest by a piece of pipe. CPR is in progress. The cardiac monitor shows sinus rhythm at 98 bpm but there is no pulse. His neck veins are distended and heart sounds are muffled. The trachea is midline and breath sounds are equal bilaterally. What is the most likely cause of this PEA arrest and what intervention is needed?,Tension pneumothorax perform needle decompression,Cardiac tamponade from blunt cardiac injury. Pericardiocentesis or thoracotomy is needed,Commotio cordis defibrillate immediately,Massive hemothorax perform chest tube,B,This patient has Beck triad of hypotension distended neck veins and muffled heart sounds indicating cardiac tamponade. In the setting of chest trauma this likely results from blunt cardiac injury with bleeding into the pericardial sac. The blood compresses the heart preventing filling and causing PEA. Unlike tension pneumothorax trachea is midline and breath sounds are equal. Treatment requires pericardiocentesis to remove blood from pericardial sac or emergency thoracotomy. Needle pericardiocentesis can be attempted using subxiphoid approach but traumatic tamponade often has clotted blood requiring surgical drainage.,Paramedic,hard
31,Cardiology,Cardiac Arrest Asystole,You respond to a 78-year-old female in a nursing home with reported cardiac arrest. Staff state she has metastatic cancer and was recently transitioned to comfort care but does not have a DNR on file. She is unresponsive and pulseless. The cardiac monitor shows a flat line. Before declaring asystole what must you verify?,Check blood glucose,Confirm asystole in at least two leads and verify connections gain and lead selection,Check pupil response,Get family confirmation of DNR status,B,Before accepting a flat line as true asystole you must rule out technical issues. Confirm asystole in at least two different leads as fine VF can appear as flat line in one lead. Check that leads are properly connected gain is turned up and monitor is functioning. If available turn up gain to maximum to look for fine VF. True asystole is confirmed when flat line persists in multiple leads with proper connections. Asystole has very poor prognosis and is not a shockable rhythm. Treatment includes CPR epinephrine and addressing reversible causes but overall survival is less than 2%.,Paramedic,hard
32,Cardiology,Cardiac Arrest ROSC,After 12 minutes of resuscitation your VF arrest patient has ROSC. He is now unconscious with BP 84/52 HR 92 RR 8 agonal and SpO2 88% on BVM. The 12-lead ECG shows ST elevation in V1-V4 consistent with his presenting anterior STEMI. What are the immediate post-ROSC management priorities?,Transport to the nearest hospital for observation,Optimize ventilation and oxygenation treat hypotension transport to PCI-capable center consider targeted temperature management,Hyperventilate to prevent cerebral edema,Allow permissive hypotension to prevent pulmonary edema,B,Post-ROSC care focuses on preventing rearrest and secondary brain injury. Optimize oxygenation targeting SpO2 94-98% and avoid hyperventilation which causes cerebral vasoconstriction. Treat hypotension with fluids and vasopressors targeting SBP above 90 and MAP above 65 to maintain cerebral perfusion. For STEMI patients emergent PCI is indicated regardless of neurological status as reperfusion improves both cardiac and neurological outcomes. Targeted temperature management at 32-36 degrees C improves neurological outcomes in comatose post-arrest patients. Begin transport to PCI-capable center with TTM capability.,Paramedic,hard
33,Cardiology,Cardiac Arrest ROSC,Your post-arrest STEMI patient has ROSC and you have secured the airway with endotracheal intubation. Blood pressure remains 78/48 despite 1 liter normal saline bolus. The cardiac monitor shows sinus tachycardia at 112 without ectopy. SpO2 is 96% on ventilator. What vasopressor would be most appropriate and what is the target blood pressure?,Dopamine 5-20 mcg/kg/min targeting SBP above 90,Norepinephrine or epinephrine infusion targeting SBP above 90 and MAP above 65,Phenylephrine 100-200 mcg boluses,Vasopressin 0.04 units/min,B,Post-arrest hypotension unresponsive to fluids requires vasopressor support. Norepinephrine or epinephrine infusions are first-line for post-arrest shock. Target SBP above 90 mmHg and MAP above 65 mmHg to maintain coronary and cerebral perfusion. Dopamine is an alternative but has higher arrhythmia risk. Phenylephrine is a pure vasoconstrictor without inotropic effects and is less ideal when myocardial dysfunction is present. Start infusion at low dose and titrate to target BP. Prepare for cath lab as reperfusion may improve hemodynamics.,Paramedic,hard
34,Cardiology,Heart Failure,A 72-year-old male presents with severe dyspnea that woke him from sleep. He has a history of heart failure with reduced ejection fraction of 30% hypertension and diabetes. His medications include furosemide carvedilol lisinopril and metformin. He is sitting bolt upright and cannot lie back. He has pink frothy sputum. On exam he has jugular venous distension crackles throughout both lung fields and 2+ lower extremity edema. Vital signs are BP 198/112 HR 118 RR 32 SpO2 82% on room air. What is the pathophysiology and what are the treatment priorities?,He is volume overloaded and needs aggressive diuresis with furosemide 80 mg IV,He has acute cardiogenic pulmonary edema from LV failure. Treatment priorities are reduce preload with nitroglycerin support oxygenation with CPAP and diuretics,He is in hypertensive crisis and needs labetalol to lower BP,He has pneumonia and needs antibiotics,B,Acute cardiogenic pulmonary edema occurs when the failing left ventricle cannot handle venous return causing back-pressure into the pulmonary circulation and fluid transudation into alveoli. The hypertension increases afterload worsening cardiac output. Treatment focuses on reducing preload with nitroglycerin which also reduces afterload supporting oxygenation with CPAP or BiPAP which reduces work of breathing and can improve cardiac function and diuretics to remove excess fluid. Nitro can be given sublingually or IV starting at 0.4 mg SL every 5 minutes or 10-20 mcg/min IV titrated.,Paramedic,hard
35,Cardiology,Heart Failure,Continuing with the CHF patient you have applied CPAP at 10 cmH2O and administered nitroglycerin 0.4 mg sublingual times two. His SpO2 has improved to 92% but his blood pressure has dropped to 88/54 and he is becoming more lethargic. What should you do now?,Continue nitroglycerin as BP is still adequate,Stop nitroglycerin immediately as he is now hypotensive and consider this may be cardiogenic shock requiring different management,Increase CPAP to 15 cmH2O,Give furosemide 80 mg IV push,B,This patient has transitioned from hypertensive pulmonary edema which responds to preload reduction to cardiogenic shock characterized by hypotension and signs of hypoperfusion. In cardiogenic shock the heart cannot generate adequate output and preload reduction with nitrates worsens hypotension. Treatment shifts from vasodilators to inotropic support. Dobutamine or dopamine may be needed to support cardiac output. Consider whether this represents acute coronary syndrome causing pump failure. Stop CPAP if causing hemodynamic compromise. This patient needs emergent transport to facility with cardiac care capabilities.,Paramedic,hard
36,Cardiology,Heart Failure,A 68-year-old male presents with progressive dyspnea and bilateral leg swelling over the past 3 weeks. He has a history of COPD and was recently diagnosed with lung cancer. He has no known cardiac history. He is dyspneic at rest but comfortable sitting up. Vital signs are BP 142/88 HR 102 RR 24 SpO2 90% on 4L NC. On exam he has markedly elevated JVP bilateral lower extremity pitting edema to the thighs and a right pleural effusion. Heart sounds are distant but regular without murmurs. His liver is palpable and tender. The ECG shows low voltage and electrical alternans. What is the most likely diagnosis?,Left heart failure from occult coronary disease,Right heart failure possibly from cardiac tamponade related to malignancy. Electrical alternans is concerning,Cor pulmonale from COPD,Bilateral DVT causing leg swelling,B,This patient has signs of right heart failure with elevated JVP edema and hepatic congestion but without pulmonary edema suggesting the left heart is not primarily involved. In a patient with malignancy pericardial effusion with tamponade must be considered. Electrical alternans is a swinging heart pattern where QRS amplitude varies beat to beat and is highly suggestive of large pericardial effusion. Malignancy is a common cause of hemorrhagic pericardial effusion. This patient needs echocardiography and possibly pericardiocentesis. The distant heart sounds also suggest fluid around the heart.,Paramedic,hard
