id,category,subcategory,question,option_a,option_b,option_c,option_d,correct_answer,rationale,certification,difficulty
80,Medical,GI,A patient has abdominal pain out of proportion to exam findings with history of atrial fibrillation. Concern:,Anxiety,Mesenteric ischemia,Gastritis,Constipation,B,Pain out of proportion with AFib suggests mesenteric ischemia from arterial embolism. Time critical.,Paramedic,medium
81,Medical,Hematologic,A patient with sickle cell disease has severe pain crisis. Management includes:,NSAIDs only,Oxygen IV fluids opioid analgesics,Aspirin,Blood transfusion in field,B,Sickle cell crisis: oxygen to reduce sickling IV hydration aggressive pain management with opioids.,Paramedic,medium
82,Medical,Hematologic,A sickle cell patient has chest pain dyspnea and fever with new pulmonary infiltrate. This is:,Simple pain crisis,Acute chest syndrome,Pneumonia only,PE,B,Acute chest syndrome: potentially fatal complication. New pulmonary infiltrate with respiratory symptoms.,Paramedic,medium
83,Medical,Hematologic,A patient on warfarin has INR of 8 with no bleeding. Management in consultation with medical control:,Emergency reversal,May not need reversal monitor for bleeding hold warfarin,Continue warfarin,Give vitamin K always,B,Elevated INR without bleeding may not need reversal. Hold warfarin. Reverse if bleeding develops.,Paramedic,medium
84,Medical,Hematologic,A patient has diffuse bleeding from IV sites and mucous membranes. Labs show low platelets elevated PT/PTT and elevated D-dimer. This is:,Hemophilia,Disseminated intravascular coagulation DIC,Warfarin overdose,Vitamin K deficiency,B,DIC: consumptive coagulopathy with bleeding and clotting. Treat underlying cause supportive care.,Paramedic,medium
85,Medical,Endocrine,A patient is confused with coarse dry skin bradycardia and hypothermia. Thyroid history unknown. Suspect:,Hyperthyroidism,Myxedema coma severe hypothyroidism,Sepsis,Drug overdose,B,Myxedema coma: severe hypothyroidism. Hypothermia bradycardia altered mental status respiratory failure.,Paramedic,medium
86,Medical,Endocrine,Treatment for myxedema coma includes:,Active cooling,Passive warming IV fluids possible thyroid hormone steroids,Cooling only,Rapid rewarming,B,Myxedema: gentle rewarming supportive care. May need thyroid hormone and stress-dose steroids.,Paramedic,medium
87,Medical,Endocrine,A patient has high fever tachycardia altered mental status tremor and goiter. Suspect:,Myxedema,Thyroid storm,Heat stroke,Sepsis,B,Thyroid storm: severe hyperthyroidism. High fever tachycardia altered mental status high mortality.,Paramedic,medium
88,Medical,Endocrine,A patient with known Addison disease has hypotension weakness and abdominal pain during an illness. This is:,Simple illness,Adrenal crisis,Dehydration,Sepsis only,B,Adrenal crisis: Addisonian patient under stress. Needs IV fluids and stress-dose steroids hydrocortisone 100mg.,Paramedic,medium
89,Medical,Endocrine,Stress dose steroids for adrenal crisis:,Dexamethasone only,Hydrocortisone 100mg IV or dexamethasone if hydrocortisone unavailable,Prednisone oral,Methylprednisolone only,B,Adrenal crisis: hydrocortisone 100mg IV has mineralocorticoid activity. Dexamethasone if cortisol level needed.,Paramedic,medium
90,Medical,Psychiatric,A patient has gradual onset confusion with visual hallucinations and fluctuating alertness. She has a fever and urinary symptoms. This is:,Dementia,Delirium likely from UTI,Schizophrenia,Depression,B,Delirium: acute confusion from medical cause. UTI common in elderly. Treat underlying cause.,Paramedic,medium
91,Medical,Psychiatric,Differentiating delirium from dementia:,Cannot be done,Delirium has acute onset fluctuating course attention deficit,They are the same,Only by testing,B,Delirium: acute fluctuating inattention medical cause. Dementia: chronic progressive.,Paramedic,medium
92,Medical,Psychiatric,A patient is having a panic attack with hyperventilation and perioral tingling. After calming she is still tachycardic with irregular pulse. Additional workup:,Not needed she had panic attack,Consider cardiac evaluation panic does not cause irregular rhythm,Discharge,Benzos only,B,Panic diagnosis of exclusion. Irregular rhythm needs cardiac evaluation even with panic symptoms.,Paramedic,medium
93,Medical,Obstetric,A pregnant patient at 28 weeks has BP 180/110 headache visual changes and proteinuria. Diagnosis:,Gestational hypertension,Severe preeclampsia,Chronic hypertension,Normal pregnancy,B,Severe preeclampsia: BP 160/110 or greater with severe features headache visual changes etc.,Paramedic,medium
94,Medical,Obstetric,The preeclamptic patient above begins seizing. Treatment:,Diazepam only,Magnesium sulfate 4-6g IV loading dose,Phenytoin,Valium and transport,B,Eclampsia: magnesium sulfate is treatment of choice. 4-6g IV load then 1-2g/hour infusion.,Paramedic,medium
95,Medical,Obstetric,Signs of magnesium toxicity include:,Hypertension,Loss of deep tendon reflexes respiratory depression,Seizures,Hypertension tachycardia,B,Mag toxicity: decreased DTR respiratory depression cardiac arrest. Antidote: calcium gluconate.,Paramedic,medium
96,Medical,Obstetric,A pregnant patient has painless bright red vaginal bleeding at 34 weeks. Suspected diagnosis:,Placental abruption,Placenta previa,Normal bloody show,Threatened miscarriage,B,Placenta previa: painless bright red bleeding from low-lying placenta. Do not perform vaginal exam.,Paramedic,medium
97,Medical,Obstetric,A pregnant patient has painful vaginal bleeding with rigid tender uterus after MVC. Suspected diagnosis:,Placenta previa,Placental abruption,Labor,Uterine rupture,B,Abruption: painful bleeding rigid uterus from placental separation. Trauma is common cause.,Paramedic,medium
98,Medical,Pediatric,A 2-year-old has barking cough inspiratory stridor and is comfortable at rest. Diagnosis and treatment:,Epiglottitis immediate intubation,Croup mild consider dexamethasone,Asthma,Foreign body,B,Croup with stridor only with agitation: mild-moderate. Dexamethasone 0.6 mg/kg. Racemic epi if severe.,Paramedic,medium
99,Medical,Pediatric,A 4-year-old has high fever drooling tripod position and appears toxic. He has stridor at rest. Diagnosis and treatment:,Croup give racemic epinephrine,Epiglottitis minimize agitation prepare for difficult airway,Asthma,Foreign body,B,Epiglottitis: do not agitate. Allow position of comfort. Prepare for surgical airway if complete obstruction.,Paramedic,medium
