aemt_id,category,subcategory,question,option_a,option_b,option_c,option_d,correct_answer,rationale
AEMT-CARD-001,AEMT Cardiology,Chest Pain Assessment,You respond to a 58-year-old male at a restaurant who is complaining of chest discomfort that began 45 minutes ago while eating dinner. He describes it as a pressure or squeezing sensation in the center of his chest that radiates to his left arm and jaw. He is diaphoretic and appears anxious. He has loosened his collar and is rubbing his chest. His wife states he has a history of high blood pressure and high cholesterol and takes lisinopril and atorvastatin. He has never had a heart attack. Vital signs are BP 162/98 HR 94 RR 20 SpO2 96% on room air. What is your initial assessment and what interventions should you perform at the AEMT level?,This is likely indigestion from eating too fast. Give him antacids and have him rest,This presentation is highly suspicious for acute coronary syndrome. Give aspirin 324 mg chewed oxygen if SpO2 drops below 94% establish IV access obtain 12-lead ECG if capable and administer nitroglycerin 0.4 mg SL if BP permits,He is having a panic attack and needs reassurance only,Wait to see if the pain resolves on its own before treating,B,This patient has classic signs of acute coronary syndrome including substernal chest pressure radiating to arm and jaw diaphoresis and multiple cardiac risk factors. At AEMT level immediate interventions include aspirin 324 mg chewed to inhibit platelet aggregation supplemental oxygen only if SpO2 is below 94% or patient is dyspneic IV access for potential medication administration 12-lead ECG if trained and equipped and nitroglycerin 0.4 mg sublingual if systolic BP is above 100 and no contraindications. Nitroglycerin can be repeated every 5 minutes up to 3 doses. Rapid transport to a cardiac-capable facility is essential.
AEMT-CARD-002,AEMT Cardiology,Chest Pain Assessment,You are treating the chest pain patient and have given aspirin 324 mg. Before administering nitroglycerin you ask about other medications. The patient states he took sildenafil Viagra last night for erectile dysfunction. His blood pressure is 158/94 and pain is 8 out of 10. Why is this information critical and how does it change your treatment plan?,Sildenafil does not interact with nitroglycerin so proceed with NTG administration,Sildenafil and similar erectile dysfunction medications potentiate the hypotensive effects of nitroglycerin. Do NOT give nitroglycerin as it could cause life-threatening hypotension. Continue other ACS treatment and transport rapidly,You can give half the normal nitroglycerin dose,The medication interaction only matters if he took it today,B,Phosphodiesterase-5 inhibitors like sildenafil Viagra tadalafil Cialis and vardenafil Levitra cause vasodilation and significantly potentiate the hypotensive effects of nitrates. Concurrent use can cause profound potentially fatal hypotension. Sildenafil and vardenafil are contraindications to nitroglycerin for 24 hours and tadalafil for 48 hours due to its longer half-life. Continue other ACS treatments including aspirin IV access oxygen if indicated and obtain 12-lead ECG. Transport rapidly and notify the hospital so they can prepare alternative treatments for his pain and ischemia.
AEMT-CARD-003,AEMT Cardiology,Chest Pain Assessment,A 67-year-old female presents with sudden onset of shortness of breath and mild chest discomfort that began 2 hours ago. She denies classic crushing chest pain but states she feels like an elephant is sitting on her chest. She has nausea and has vomited once. She appears pale and is diaphoretic. She has a history of diabetes and hypertension. Her medications include metformin glipizide and lisinopril. Vital signs are BP 146/88 HR 102 RR 24 SpO2 93% on room air. Blood glucose is 186 mg/dL. Why should you suspect ACS despite her atypical presentation?,Her blood sugar is elevated so this is a diabetic emergency not cardiac,Women and diabetics often have atypical ACS presentations. Her symptoms of dyspnea chest pressure nausea diaphoresis with cardiac risk factors should be treated as ACS. Give aspirin oxygen establish IV and obtain 12-lead ECG,Since she denies crushing chest pain this is not a heart attack,She is too young to have a heart attack,B,Women diabetics and elderly patients frequently present with atypical symptoms of acute coronary syndrome. Instead of classic crushing substernal chest pain they may have dyspnea fatigue nausea vomiting back pain jaw pain or vague discomfort. Diabetic neuropathy can blunt cardiac pain perception. This patient has multiple risk factors diabetes hypertension older age and symptoms that could represent ACS. Treat her the same as a patient with classic symptoms including aspirin supplemental oxygen for her hypoxia IV access and 12-lead ECG. Her atypical presentation does not make her condition less serious.
AEMT-CARD-004,AEMT Cardiology,12-Lead ECG,You have obtained a 12-lead ECG on a 62-year-old male with chest pain. The ECG shows ST segment elevation of 3 mm in leads II III and aVF with reciprocal ST depression in leads I and aVL. The patient's blood pressure is 88/58 and he feels lightheaded when sitting up. Before giving nitroglycerin what must you consider about this ECG pattern?,The low blood pressure alone contraindicates nitroglycerin,ST elevation in leads II III aVF indicates inferior wall MI which often involves the right ventricle. RV infarction is preload-dependent and nitroglycerin can cause severe hypotension. With his already low BP nitroglycerin is contraindicated. Give IV fluid bolus instead,This ECG pattern is normal and he does not need treatment,Give nitroglycerin to improve his blood flow,B,ST elevation in leads II III and aVF indicates inferior wall myocardial infarction typically caused by right coronary artery occlusion. The RCA also supplies the right ventricle in most people so inferior MI often involves RV infarction. The right ventricle depends heavily on preload to maintain cardiac output. Nitroglycerin causes venodilation reducing preload which can cause severe hypotension and cardiovascular collapse in RV infarction. This patient already has hypotension making nitroglycerin especially dangerous. Instead give IV normal saline bolus to maintain preload. Right-sided ECG leads particularly V4R can confirm RV involvement if you are trained to obtain them.
AEMT-CARD-005,AEMT Cardiology,12-Lead ECG,You obtain a 12-lead ECG on a 55-year-old male with crushing chest pain. The ECG shows ST elevation in leads V1 V2 V3 and V4 with reciprocal depression in the inferior leads. What does this indicate and what is the significance for the patient?,This is a normal ECG variant and not concerning,This shows anterior wall STEMI involving the left anterior descending artery. This is a large territory MI with significant mortality risk. Activate the cath lab early and transport immediately to a PCI-capable hospital,This indicates the patient is having a panic attack,Wait to get a second ECG to confirm,B,ST elevation in the precordial leads V1-V4 indicates anterior wall myocardial infarction caused by occlusion of the left anterior descending LAD artery. The LAD supplies a large territory including the anterior wall of the left ventricle and the anterior interventricular septum. Anterior MIs carry higher mortality than inferior MIs due to the larger amount of myocardium at risk. Early recognition allows activation of the cardiac catheterization lab so the team is ready when the patient arrives. Time is muscle and every minute of delay increases myocardial damage. Transport rapidly to a PCI-capable facility.
AEMT-CARD-006,AEMT Cardiology,Nitroglycerin Administration,A 72-year-old female with a history of angina presents with chest pain similar to her usual angina. She took one of her own nitroglycerin tablets 10 minutes ago without relief. Her pain is now 7 out of 10. Vital signs are BP 148/88 HR 82 RR 18 SpO2 97% on room air. She denies taking any erectile dysfunction medications and has no other contraindications. You have given aspirin. What is the appropriate approach to nitroglycerin administration?,She already took nitroglycerin so you should not give more,Administer nitroglycerin 0.4 mg sublingual. You can give up to 3 doses total including her home dose at 5-minute intervals as long as systolic BP remains above 100 and she has no contraindications,Give her three nitroglycerin tablets at once for faster relief,Nitroglycerin is not appropriate for angina only for heart attacks,B,Nitroglycerin causes coronary vasodilation and venodilation reducing cardiac workload and improving blood flow to ischemic myocardium. It can be administered every 5 minutes up to 3 total doses for ongoing chest pain as long as systolic blood pressure remains above 100 mmHg and there are no contraindications. Her home dose counts toward the total. Monitor blood pressure before each dose. If pain persists after 3 doses and BP remains adequate this suggests more severe ischemia or infarction rather than stable angina. Continue monitoring and transport. Document response to each nitroglycerin dose.
AEMT-CARD-007,AEMT Cardiology,Nitroglycerin Administration,After the second nitroglycerin dose the angina patient states her pain is now 3 out of 10 much improved. However her blood pressure has dropped from 148/88 to 96/62 and she feels dizzy. What should you do?,Give a third nitroglycerin to eliminate the remaining pain,Do not give additional nitroglycerin due to the hypotension. Lay her supine elevate her legs and consider a small IV fluid bolus. Monitor closely and be prepared if blood pressure drops further,Her pain improved so the blood pressure drop is acceptable,Give her aspirin to raise her blood pressure,B,Hypotension is a side effect of nitroglycerin due to its vasodilatory effects. A systolic blood pressure below 100 mmHg is a contraindication to additional nitroglycerin. Lay the patient supine and elevate her legs to improve venous return and blood pressure. A small IV fluid bolus 250 mL may help restore blood pressure. Continue to monitor her closely. Her chest pain has improved significantly which is the goal but you cannot give more nitroglycerin with this blood pressure. If her blood pressure does not improve or she develops signs of shock further interventions may be needed. Document the blood pressure drop and your response.
AEMT-CARD-008,AEMT Cardiology,Cardiac Rhythm Recognition,A 68-year-old male presents with palpitations and lightheadedness that started suddenly 1 hour ago. He has no chest pain. He has a history of hypertension. Vital signs are BP 108/72 HR 178 regular RR 18 SpO2 98% on room air. The cardiac monitor shows a regular narrow complex tachycardia at 178 bpm without visible P waves. What is the most likely rhythm and what is the AEMT role in management?,This is ventricular tachycardia and he needs immediate defibrillation,This is most likely supraventricular tachycardia SVT. At AEMT level provide supportive care IV access monitoring consider vagal maneuvers if trained and protocolized and prepare for transport. Adenosine is typically a paramedic-level intervention,This is normal sinus tachycardia from anxiety,His heart rate is not fast enough to cause symptoms,B,A regular narrow complex tachycardia at 178 bpm without visible P waves is most consistent with supraventricular tachycardia likely AVNRT or AVRT. The patient is hemodynamically stable with adequate blood pressure and only mild symptoms. At AEMT level your role includes establishing IV access continuous cardiac monitoring and considering vagal maneuvers such as Valsalva or modified Valsalva if these are within your protocols and training. Vagal maneuvers can terminate SVT by increasing parasympathetic tone. Adenosine administration is typically at the paramedic level. Monitor for deterioration and transport for definitive treatment.
AEMT-CARD-009,AEMT Cardiology,Cardiac Rhythm Recognition,Your SVT patient suddenly becomes pale and diaphoretic. His blood pressure drops to 76/50 and he states he feels like he might pass out. He is now confused. The rhythm remains narrow complex tachycardia at 182 bpm. What has changed and what is now indicated?,Continue monitoring and transport as he is still stable,He has become hemodynamically unstable with hypotension and altered mental status. Unstable tachycardia requires synchronized cardioversion which is ALS intervention. Provide supportive care call for ALS backup if available and transport rapidly,Give nitroglycerin to improve his blood flow,This is a normal response to SVT,B,This patient has transitioned from stable to unstable tachycardia. Signs of hemodynamic instability include hypotension altered mental status syncope chest pain and signs of shock. Unstable tachycardia requires immediate intervention to restore perfusion. Synchronized cardioversion is the treatment for unstable narrow complex tachycardia and is typically a paramedic-level intervention. At AEMT level provide supportive care including IV access oxygen and positioning. Call for ALS intercept if available. If the patient loses pulses this becomes pulseless VT or VF requiring defibrillation. Prepare for possible cardiac arrest and transport rapidly.
AEMT-CARD-010,AEMT Cardiology,Cardiac Rhythm Recognition,A 75-year-old female presents with fatigue and dizziness for the past day. She nearly passed out this morning. She has a history of heart disease and takes metoprolol and lisinopril. Vital signs are BP 94/58 HR 42 regular RR 16 SpO2 96% on room air. The cardiac monitor shows a regular rhythm at 42 bpm with narrow QRS complexes. P waves are visible and each P wave is followed by a QRS. What is this rhythm and how should you manage this patient?,This is sinus bradycardia with symptoms. Provide supportive care with IV fluids position supine with legs elevated and monitor closely. Atropine and pacing are ALS interventions,This is a heart block requiring immediate CPR,Her heart rate is normal for an elderly patient on metoprolol,Give nitroglycerin to increase her heart rate,A,This is sinus bradycardia at 42 bpm which is slow. The consistent P waves each followed by a QRS indicates the rhythm originates in the SA node and conducts normally just at a slow rate. This patient is symptomatic with hypotension near-syncope and fatigue making this symptomatic bradycardia. Her metoprolol a beta-blocker may be contributing to the slow rate. At AEMT level provide supportive care including IV access IV fluid bolus for hypotension positioning supine with legs elevated to improve perfusion and continuous monitoring. Atropine and transcutaneous pacing are ALS interventions. Transport with monitoring.
AEMT-CARD-011,AEMT Cardiology,Cardiac Rhythm Recognition,A 70-year-old male presents with weakness and confusion. His wife says he has been deteriorating over the past few hours. He has a pacemaker implanted 5 years ago. Vital signs are BP 82/54 HR 35 RR 18 SpO2 94% on room air. The cardiac monitor shows pacer spikes followed by QRS complexes at a rate of 35 but you also see pacer spikes that are NOT followed by QRS complexes. What pacemaker malfunction is occurring and how should you manage this?,The pacemaker is working normally just at a slow rate,This is pacemaker failure to capture where some pacer spikes are not causing cardiac contraction. The patient is symptomatic. Provide supportive care with IV fluids and positioning and transport urgently. External pacing may be needed as a bridge,Turn off the pacemaker with a magnet,This is not a pacemaker problem,B,Failure to capture occurs when the pacemaker generates an electrical impulse pacer spike but the impulse does not cause myocardial depolarization resulting in no QRS complex following some spikes. Causes include lead dislodgement or fracture battery depletion increased capture threshold from fibrosis or medications and electrolyte abnormalities. This patient is symptomatic with hypotension altered mental status and inadequate heart rate. At AEMT level provide supportive care including IV access IV fluid bolus and positioning. Transcutaneous pacing may override the failing pacemaker and is an ALS intervention. Transport urgently for pacemaker evaluation and possible replacement.
AEMT-CARD-012,AEMT Cardiology,Cardiac Rhythm Recognition,A 78-year-old female is found unresponsive by her husband. She has no pulse and is not breathing. You attach the cardiac monitor while your partner begins CPR. The monitor shows a flat line in the lead you are viewing. Before confirming asystole what must you verify?,The flat line confirms asystole. Begin ACLS protocol,Verify asystole by checking in at least two different leads ensuring leads are properly connected checking monitor gain and confirming this is not fine ventricular fibrillation,A flat line always means the patient is dead,Check her blood sugar before doing anything else,B,Before accepting asystole you must rule out technical issues and fine VF which can appear as a flat line. Verify in at least two different leads by changing lead selection on the monitor. Confirm all leads are properly connected to both the monitor and the patient. Check that the gain is turned up appropriately. Fine VF may appear as a flat line in one lead but show fibrillation in another. True asystole confirmed in multiple leads with proper connections has a very poor prognosis. If confirmed asystole begin CPR and ACLS protocols including epinephrine and addressing reversible causes. Asystole is not a shockable rhythm.
AEMT-CARD-013,AEMT Cardiology,Cardiac Arrest Management,You arrive at a residence where a 62-year-old male collapsed 3 minutes ago. His wife called 911 and has been performing CPR as instructed by dispatch. You find him unresponsive and pulseless. The AED is attached and advises shock. What are your immediate priorities and actions in managing this cardiac arrest at the AEMT level?,Wait for paramedics to arrive before doing anything,Deliver the shock immediately then resume high-quality CPR. Establish IV or IO access and administer epinephrine 1 mg per protocol. Continue cycles of CPR rhythm analysis and shocks as indicated. Prepare airway equipment,Check his blood sugar first,Start CPR and wait 2 minutes before analyzing the rhythm,B,In cardiac arrest immediate priorities are high-quality CPR and early defibrillation for shockable rhythms. Deliver the shock immediately then resume CPR for 2 minutes before the next rhythm check. At AEMT level you can establish IV or IO access and administer epinephrine 1 mg IV/IO every 3-5 minutes per your protocols. Maintain high-quality CPR with minimal interruptions compression rate 100-120 per minute depth 2-2.4 inches allowing full chest recoil. Provide BVM ventilation with high-flow oxygen. Prepare for advanced airway if BVM is inadequate. AEMTs play a critical role in the chain of survival.
AEMT-CARD-014,AEMT Cardiology,Cardiac Arrest Management,You are managing the cardiac arrest patient. After the second shock and 2 minutes of high-quality CPR the rhythm changes from ventricular fibrillation to an organized narrow complex rhythm at 72 bpm. You stop CPR to check for a pulse. You feel a weak carotid pulse and the patient has some spontaneous agonal respirations at 6 per minute. BP is 68/42. What has occurred and what are your priorities now?,Resume CPR because the blood pressure is too low,The patient has achieved return of spontaneous circulation ROSC. Do not resume CPR if pulse is present. Priorities are airway management ventilation at 10-12 per minute oxygenation and blood pressure support with IV fluids. Continue monitoring for rearrest,The rhythm is PEA and you should continue CPR,Terminate resuscitation since his breathing is inadequate,B,Return of spontaneous circulation ROSC is indicated by a perfusing rhythm with palpable pulse. This patient has ROSC despite his low blood pressure and inadequate breathing. Do not perform CPR on a patient with a pulse. Post-ROSC priorities include airway management with continued BVM ventilation at 10-12 breaths per minute targeting SpO2 94-98% blood pressure support with IV crystalloid bolus targeting SBP greater than 90 mmHg and continuous monitoring as rearrest is common in the early post-ROSC period. Transport to a facility capable of post-cardiac arrest care including potential cardiac catheterization and targeted temperature management.
AEMT-CARD-015,AEMT Cardiology,Cardiac Arrest Management,During transport your post-ROSC patient suddenly becomes pulseless again. The monitor shows ventricular fibrillation. What do you do?,Continue transport without intervention since he already arrested once,Immediately defibrillate and resume CPR. Rearrest is common after ROSC and requires immediate intervention. Continue resuscitation efforts during transport,Pronounce the patient dead since he arrested twice,Check his blood glucose,B,Rearrest after ROSC is common occurring in up to 50% of patients initially resuscitated. When rearrest occurs immediate defibrillation and CPR are required just as with the initial arrest. Do not give up on a patient who rearrests. Defibrillate immediately for VF resume high-quality CPR and continue resuscitation efforts. Epinephrine and other interventions should continue per ACLS protocols. Patients can have multiple episodes of arrest and ROSC. Continue aggressive resuscitation during transport. The patient achieved ROSC once indicating a potentially salvageable heart and should be given every chance at survival.
AEMT-CARD-016,AEMT Cardiology,Cardiac Arrest Special Situations,You respond to a cardiac arrest in a 55-year-old male who was found in a bathtub. The bathroom is cold and the water in the tub is cold. He is unresponsive and pulseless. His body temperature feels very cold to touch. CPR is initiated. What modifications to resuscitation should you consider for a hypothermic cardiac arrest?,Hypothermic patients cannot be resuscitated so do not attempt CPR,Hypothermic patients may appear dead but can have excellent neurological recovery even after prolonged arrest. Continue CPR handle gently and if in VF defibrillate once then focus on CPR and rewarming. Medications may be ineffective when cold,Use hot water bottles on his chest during CPR,Pronounce death immediately due to the cold exposure,B,Hypothermic cardiac arrest requires modified resuscitation. The saying you are not dead until you are warm and dead reflects the neuroprotective effects of hypothermia. Patients have survived with good neurological outcomes after prolonged arrest in severe hypothermia. Handle the patient gently as rough movement can trigger arrhythmias in the hypothermic heart. If in VF defibrillate once but if unsuccessful defer additional shocks until temperature rises above 86F or 30C as the cold heart is resistant to defibrillation. Continue high-quality CPR. Medications are less effective when cold. Focus on rewarming and transport to a facility capable of active core rewarming.
AEMT-CARD-017,AEMT Cardiology,Cardiac Arrest Special Situations,A 34-year-old pregnant female at approximately 32 weeks gestation collapses and is found to be pulseless. CPR is initiated. What modification is essential when performing CPR on a pregnant patient in the third trimester?,No modifications are needed for pregnant patients,Perform CPR with manual left uterine displacement by having someone push the uterus to the left. The gravid uterus compresses the IVC when supine reducing venous return and making standard CPR less effective,Perform CPR with the patient on her left side only,CPR is contraindicated in pregnancy,B,In late pregnancy the gravid uterus compresses the inferior vena cava when the patient is supine reducing venous return by up to 30%. This makes standard CPR less effective because cardiac output during compressions depends on adequate venous return. Manual left uterine displacement is performed by having one rescuer push the uterus continuously to the patient's left side while CPR is performed on a firm flat surface. This moves the uterus off the IVC improving venous return. All standard ACLS medications and defibrillation are indicated in pregnancy. If no ROSC occurs within 4-5 minutes perimortem cesarean delivery may be indicated to relieve aortocaval compression.
AEMT-CARD-018,AEMT Cardiology,Heart Failure,A 68-year-old male with a history of heart failure presents with worsening shortness of breath over the past 3 days. He cannot lie flat and has been sleeping in a recliner. He has bilateral lower extremity edema that is worse than his baseline. He admits to eating salty foods and missing some doses of his diuretic. Vital signs are BP 162/94 HR 96 RR 26 SpO2 90% on room air. Lung sounds reveal crackles in both lower lung fields. What type of heart failure exacerbation is this and what is appropriate AEMT treatment?,He has a respiratory infection and needs antibiotics,This is acute decompensated heart failure with pulmonary edema from fluid overload. Treatment includes sitting him upright high-flow oxygen or CPAP if available and in your scope and nitroglycerin if blood pressure supports it,He has pneumonia not heart failure,Give him IV fluids for dehydration,B,This patient has classic signs of acute decompensated heart failure with orthopnea inability to lie flat pulmonary edema crackles elevated JVP peripheral edema and identified triggers dietary indiscretion and diuretic non-compliance. The fluid overload has caused pulmonary edema impairing oxygenation. Treatment focuses on reducing preload and improving oxygenation. Sit him upright to reduce venous return. Provide high-flow oxygen or CPAP if available as positive pressure improves oxygenation and reduces preload. Nitroglycerin 0.4 mg SL causes venodilation reducing preload and is appropriate if SBP is above 100. Do NOT give IV fluids as this would worsen fluid overload.
